web-scraper-order,web-scraper-start-url,pages,pages-href,reviews
"1689930021-1","https://www.tripadvisor.com/Hotel_Review-g150807-d152896-Reviews-or80-Hard_Rock_Hotel_Cancun-Cancun_Yucatan_Peninsula.html#REVIEWS","11","https://www.tripadvisor.com/Hotel_Review-g150807-d152896-Reviews-or100-Hard_Rock_Hotel_Cancun-Cancun_Yucatan_Peninsula.html","Very beautiful, must visit. Workers are very friendly and attentive.Our butlers were AB and Hector and they did a great job on making sure our needs were met and that we were having a great time. They speak Spanish and English so that was very helpful."
"1689930021-2","https://www.tripadvisor.com/Hotel_Review-g150807-d152896-Reviews-or80-Hard_Rock_Hotel_Cancun-Cancun_Yucatan_Peninsula.html#REVIEWS","11","https://www.tripadvisor.com/Hotel_Review-g150807-d152896-Reviews-or100-Hard_Rock_Hotel_Cancun-Cancun_Yucatan_Peninsula.html","This property is very intimate which provides for exceptional service and a great time. Because the property isn't big, you truly get to know the staff and it makes the experience much better. There's personalized service throughout, staff is really friendly, and there's nice activities on and off property. Highly recommend!"
"1689930021-3","https://www.tripadvisor.com/Hotel_Review-g150807-d152896-Reviews-or80-Hard_Rock_Hotel_Cancun-Cancun_Yucatan_Peninsula.html#REVIEWS","11","https://www.tripadvisor.com/Hotel_Review-g150807-d152896-Reviews-or100-Hard_Rock_Hotel_Cancun-Cancun_Yucatan_Peninsula.html","Horrible experience. We were invited to the hotel by the Legendary Vacation Club company. Please take my advice into consideration and do not get scammed. It was a huge waist of our time, at the end they offered us a day pass as a “gift certificate” which I am being charged for now. They also offered 2 all inclusive tour experience as an incentive to go hear their offers which at the end we would have to pay expensive transportation if we accepted so we just ended up wasting a full day of our vacation time :( The resort was deficient in many ways. If you want to experience this beautiful part of Mexico look for a better option worthy of your money."
"1689930021-4","https://www.tripadvisor.com/Hotel_Review-g150807-d152896-Reviews-or80-Hard_Rock_Hotel_Cancun-Cancun_Yucatan_Peninsula.html#REVIEWS","11","https://www.tripadvisor.com/Hotel_Review-g150807-d152896-Reviews-or100-Hard_Rock_Hotel_Cancun-Cancun_Yucatan_Peninsula.html","This is my husband and I’s second trip to HR Cancun- last one being in 2018. We truly loved it both times though there were some notable changes, as to be expected after 5 years. The food was very good- the romantic dinner by the beach was gorgeous. We spent majority of our time at the pool and had the best service from Principe- he was AMAZING and made you feel like you were the most important person in the pool even though he was serving well over 20 people at a time. We did miss the taco bar that used to be by the pool but the burgers and pizza held us over until dinner. Maintenance was being done at the time but honestly we didn’t notice the noise much as we were just focused on enjoying ourselves. Our ONLY major complaint is the pushy sales to become Legendary members which"
"1689930021-5","https://www.tripadvisor.com/Hotel_Review-g150807-d152896-Reviews-or80-Hard_Rock_Hotel_Cancun-Cancun_Yucatan_Peninsula.html#REVIEWS","11","https://www.tripadvisor.com/Hotel_Review-g150807-d152896-Reviews-or100-Hard_Rock_Hotel_Cancun-Cancun_Yucatan_Peninsula.html","One of the great resort in Cancun, the crew is very helpful and kind. Also very clean place to stay, with great restaurants and bars. Goretti was really nice the whole time. Thanks for the great place."
"1689930021-6","https://www.tripadvisor.com/Hotel_Review-g150807-d152896-Reviews-or80-Hard_Rock_Hotel_Cancun-Cancun_Yucatan_Peninsula.html#REVIEWS","11","https://www.tripadvisor.com/Hotel_Review-g150807-d152896-Reviews-or100-Hard_Rock_Hotel_Cancun-Cancun_Yucatan_Peninsula.html","The first time staying at Hard Rock, the first time in Mexico was a great experience. The staff, food, room, listening to ocean in the morning, great experience! I have told my friends and family to stay here. I will be back!"
"1689930021-7","https://www.tripadvisor.com/Hotel_Review-g150807-d152896-Reviews-or80-Hard_Rock_Hotel_Cancun-Cancun_Yucatan_Peninsula.html#REVIEWS","11","https://www.tripadvisor.com/Hotel_Review-g150807-d152896-Reviews-or100-Hard_Rock_Hotel_Cancun-Cancun_Yucatan_Peninsula.html","I really wanted to give this resort a five-star review but two areas of the experience frustrated me. Check in and check out are not efficient processes and take quite a bit of time to complete. Also the upselling of the resort both at check-in and check out, I do not enjoy.  The hotel itself is older, but if you can get past the aesthetic, it's a wonderful place to stay. The staff there is super accommodating, super friendly and are a great time to interact with. The food is quite good with my favorite restaurant being Toro with a very close second being zenn.  Every night the wait stuff of all the establishments were accommodating and quick with refills or any accommodation.  The hotel room itself is dated but they are doing renovations.  Our room was with an ocean view. The"
"1689930021-8","https://www.tripadvisor.com/Hotel_Review-g150807-d152896-Reviews-or80-Hard_Rock_Hotel_Cancun-Cancun_Yucatan_Peninsula.html#REVIEWS","11","https://www.tripadvisor.com/Hotel_Review-g150807-d152896-Reviews-or100-Hard_Rock_Hotel_Cancun-Cancun_Yucatan_Peninsula.html","For the price they charge this resort is not worth it. Food is very average. Pool and room need updates and maintenance. Broken tiles all over the pool - cutting hazards.   Staff is the only saving grace. They are very helpful and positive overall. However until the resort resolves it’s maintenance and food quality issues - save your money and go elsewhere."
"1689930041-9","https://www.tripadvisor.com/Hotel_Review-g150807-d152896-Reviews-or80-Hard_Rock_Hotel_Cancun-Cancun_Yucatan_Peninsula.html#REVIEWS","10","https://www.tripadvisor.com/Hotel_Review-g150807-d152896-Reviews-or90-Hard_Rock_Hotel_Cancun-Cancun_Yucatan_Peninsula.html","Where do I even begin with this review  After paying well over $4000 for two for 6 nights we were left beyond disappointed with not only the state of the resort but the staff treatment as well, if we count the whole group as a whole, the money spent was close to $13,000.  Hard Rock bases their guests attendance ON MEMBERSHIPS, hence you’ll see wristbands of different colors everywhere, this is for the staff to identify who deserves a better service despite how much people has paid for their vacation, and all this is a problem that corporation is very well aware of, I’ll explain soon.   The resort needs to close down for a while and be completely renovated, hallway ceilings are moldy, leaky and swelled up to the point it’s cracking, soon they will start falling apart, not to"
"1689930041-10","https://www.tripadvisor.com/Hotel_Review-g150807-d152896-Reviews-or80-Hard_Rock_Hotel_Cancun-Cancun_Yucatan_Peninsula.html#REVIEWS","10","https://www.tripadvisor.com/Hotel_Review-g150807-d152896-Reviews-or90-Hard_Rock_Hotel_Cancun-Cancun_Yucatan_Peninsula.html","I stayed at the Hard Rock Hotel from 9th - 12th May 2023 during a business trip. The surroundings were always spotless, the staff super friendly and the live nightly entertainment was top notch.   While the restaurants did lack variety in my opinion, overall my stay was comfortable and I would definitely recommend to family and friends."
"1689930041-11","https://www.tripadvisor.com/Hotel_Review-g150807-d152896-Reviews-or80-Hard_Rock_Hotel_Cancun-Cancun_Yucatan_Peninsula.html#REVIEWS","10","https://www.tripadvisor.com/Hotel_Review-g150807-d152896-Reviews-or90-Hard_Rock_Hotel_Cancun-Cancun_Yucatan_Peninsula.html","Very disappointed  with this hotel , first time staying at hard rock , the hotel is very outdated , and lacks spaces for entertainment. The lobby/bar looks like an office space,  full of desks and no place to entertain or dance , been too many hotels all inclusive and regular ones and I feetl like my money wasn't worth it at all , unless you have or pay for the ""forced "" membership they don't Even notice you are here and treat you like a 3rd class guest.  I  came to Mexico expecting to feel like I was in Mexico but it wasn't the case at all , the only Mexican ""experiences "" were limited for the vip/members only at the terrace. The hot tubs in the rooms were  extremely dirty with mold coming out of the jets.  The staff at the restaurants were very attentive and nice, on the other"
"1689930041-12","https://www.tripadvisor.com/Hotel_Review-g150807-d152896-Reviews-or80-Hard_Rock_Hotel_Cancun-Cancun_Yucatan_Peninsula.html#REVIEWS","10","https://www.tripadvisor.com/Hotel_Review-g150807-d152896-Reviews-or90-Hard_Rock_Hotel_Cancun-Cancun_Yucatan_Peninsula.html","Wonderful experience. I was enjoying of all the amenities and decided to take a dip in the beach before getting ready for dinner. Like many things that happen in the unexpected ocean I felt a sharp pain in my arm. Something seemed to bite me and the second I came out of the water and rushed to my daughter the team of life guards came and attended to me. Helped ease my nerves and cleaned and attended to my wounds properly. The main lifeguard was Sarahi Matadamas she wouldn't leave my side till she knew I was feeling better and informed me of all the next steps. I'm not sure of the names of the rest of the team but multiple people rushed over and gave me everything I could need. My biggest thank yous to them"
"1689930041-13","https://www.tripadvisor.com/Hotel_Review-g150807-d152896-Reviews-or80-Hard_Rock_Hotel_Cancun-Cancun_Yucatan_Peninsula.html#REVIEWS","10","https://www.tripadvisor.com/Hotel_Review-g150807-d152896-Reviews-or90-Hard_Rock_Hotel_Cancun-Cancun_Yucatan_Peninsula.html","Stayed at the Hard Rock Cancun for the long weekend with my fiancé.  I’ve been to other HRHs but first time in Cancun.  It was amazing!  Service was outstanding, great quality top shelf drinks, the view is incredible.    The pool concierge team (Tacho, Angel & Edwin) went out of their way to get us premier pool chairs and umbrella each day.  Awesome service and always could count on them.  Our server at Ciao, Carlos, was one of the best we’ve had.  His Mexican coffee at the end was delicious!  The entertainment staff was incredible, and all of them were great.  Big thank you to Christian for helping us find a song we wanted to use for our wedding intro- we appreciate that so much!   Great crowd, great views, hamburgers are the best.  Definitely worth it even if we only had 3"
"1689930041-14","https://www.tripadvisor.com/Hotel_Review-g150807-d152896-Reviews-or80-Hard_Rock_Hotel_Cancun-Cancun_Yucatan_Peninsula.html#REVIEWS","10","https://www.tripadvisor.com/Hotel_Review-g150807-d152896-Reviews-or90-Hard_Rock_Hotel_Cancun-Cancun_Yucatan_Peninsula.html","Hard Rock Cancun we were there in May of 2023 our trip was wonderful the weather was great food was good our room was very clean not complaints we love traveling there it is a smaller hotel but it does not lack service."
"1689930061-15","https://www.tripadvisor.com/Hotel_Review-g150807-d152896-Reviews-or80-Hard_Rock_Hotel_Cancun-Cancun_Yucatan_Peninsula.html#REVIEWS","8","https://www.tripadvisor.com/Hotel_Review-g150807-d152896-Reviews-or70-Hard_Rock_Hotel_Cancun-Cancun_Yucatan_Peninsula.html","Travelled to HRC June 4-11, return trip, 18 total in our group. Check in easy. Pool warm   Excellent towel service (Seki) and the best cheeseburgers (not Kidding)cooked by Linette at the pool. Now it’s Saturday night and No Buffet.  So good luck getting a table at the sit downs.  Generally noisy place with one of 2 swim up bars closed. Security good but had a drunk trying to enter our room one midnight  They need to rehab the pool tiles and put AC in the Asian restaurant. Very hard working staff but the up selling is extreme  Maybe a Riu or an Iberostar for me next trip to Mexico"
"1689930061-16","https://www.tripadvisor.com/Hotel_Review-g150807-d152896-Reviews-or80-Hard_Rock_Hotel_Cancun-Cancun_Yucatan_Peninsula.html#REVIEWS","8","https://www.tripadvisor.com/Hotel_Review-g150807-d152896-Reviews-or70-Hard_Rock_Hotel_Cancun-Cancun_Yucatan_Peninsula.html","Hard Rock must translate to classless guests in Spanish.  As a result, they are very heavy-handed with security. The customer service is horrible. The building is old. The umbrellas are rusty. The beds are stained. They constantly try to corral you into their ""members club"" scam sales presentation. They don't take no for an answer and the sales people are pushy. You wait in line for everything. Your whole vacation is wasted waiting in line or being harassed by security or being chased by sales people. My wife and I have been to Cancun many times over the years and I have to say this is the worst experience we've had there and we won't be returning to this hotel. Oh, and the grinding tile saw was a nice touch on the beach all day."
"1689930061-17","https://www.tripadvisor.com/Hotel_Review-g150807-d152896-Reviews-or80-Hard_Rock_Hotel_Cancun-Cancun_Yucatan_Peninsula.html#REVIEWS","8","https://www.tripadvisor.com/Hotel_Review-g150807-d152896-Reviews-or70-Hard_Rock_Hotel_Cancun-Cancun_Yucatan_Peninsula.html","Our Butler’s Rafa and Rorro did a great job making sure we were comfortable. They made dinner reservations and reserved pool chairs each day., they were there for everything we wanted and went to extreme to take very good care of our family. If visiting the Cancun Hard Rock again we would definitely request to have them!"
"1689930061-18","https://www.tripadvisor.com/Hotel_Review-g150807-d152896-Reviews-or80-Hard_Rock_Hotel_Cancun-Cancun_Yucatan_Peninsula.html#REVIEWS","8","https://www.tripadvisor.com/Hotel_Review-g150807-d152896-Reviews-or70-Hard_Rock_Hotel_Cancun-Cancun_Yucatan_Peninsula.html","Hard Rock Cancun was amazing! The entertainment staff did an excellent job of engaging people in activities and creating a fun experience! The food was great and there was always someone checking in to make sure you had all you need!  However, what truly made our trip extra special was Neto and Gerkyl! They were hands down the two key individuals that allowed for our family to focus on relaxing, having fun and being together. The private dinner was such a wonderful way to close out our vacation and the view was one of the best. Thank you Neto and Gerkyl for being so kind, attentive and proactive with ensuring all things went smoothly! What a blessing being able to get us all together in such a beautiful place!"
"1689930061-19","https://www.tripadvisor.com/Hotel_Review-g150807-d152896-Reviews-or80-Hard_Rock_Hotel_Cancun-Cancun_Yucatan_Peninsula.html#REVIEWS","8","https://www.tripadvisor.com/Hotel_Review-g150807-d152896-Reviews-or70-Hard_Rock_Hotel_Cancun-Cancun_Yucatan_Peninsula.html","Do your research..... There are much nicer resorts in Cancun area. For what they charge this should be at least a 5 star resort... I would rate it a 2 star. Old, run down, pool is lame, no happy fun vibe what so ever, one swim up bar is closed for renovations, thats all you hear all day long is saws and equip. Food is OK. restaurant hours are horrible, breakfast is horrible they are all buffets in morning. They claim to be a top resort for kids and teenagers. Hardly any kids there. Reason being, there is nothing for kids or teens to do. The Timeshare sales staff is extremely pushy even though they claim they are not. Called our room at least twice a day trying to sell their timeshare pkg. Then would stalk you around the resort trying to book you in for their sales pitch.. We"
"1689930061-20","https://www.tripadvisor.com/Hotel_Review-g150807-d152896-Reviews-or80-Hard_Rock_Hotel_Cancun-Cancun_Yucatan_Peninsula.html#REVIEWS","8","https://www.tripadvisor.com/Hotel_Review-g150807-d152896-Reviews-or70-Hard_Rock_Hotel_Cancun-Cancun_Yucatan_Peninsula.html","From the moment, my roommate and I entered the room we were a bit disappointed. We paid extra for ocean view however our room had a big building blocking part of the ocean. Then, upon sitting on the bed I found a blonde string of hair (neither of our dark hair) and smudges on one of my pillows. On the second day, our room wasn’t cleaned and when asked the housekeeper was rude and proceeded to hang up on us. Lastly, when attempting to set up transportation to return home we were promptly told the concierge could help us. Then ignored by the concierge while she typed on the computer for at least 20 mins. Only when I complained to my friend about the lack of service and review I would be writing did the staff member decide to assist us. Even if you’re not looking for a “luxury”"
"1689930061-21","https://www.tripadvisor.com/Hotel_Review-g150807-d152896-Reviews-or80-Hard_Rock_Hotel_Cancun-Cancun_Yucatan_Peninsula.html#REVIEWS","8","https://www.tripadvisor.com/Hotel_Review-g150807-d152896-Reviews-or70-Hard_Rock_Hotel_Cancun-Cancun_Yucatan_Peninsula.html","Great service and delicious food at all restaurants. Hotel is at a great location..  service throughout the hotel has been amazing.  Rooms could use renovation.  Entertainment has been wonderful and very enjoyable.   All areas throughout the hotel have been very clean."
"1689930061-22","https://www.tripadvisor.com/Hotel_Review-g150807-d152896-Reviews-or80-Hard_Rock_Hotel_Cancun-Cancun_Yucatan_Peninsula.html#REVIEWS","8","https://www.tripadvisor.com/Hotel_Review-g150807-d152896-Reviews-or70-Hard_Rock_Hotel_Cancun-Cancun_Yucatan_Peninsula.html","everything was great from the moment I arrived until my exit, the spa was absolutely magnificent, The food in each dining area was delish. the entertainment was flawless especially Studio 54 and the Michael Jackson review. the Reggae band was awesome. In spite of the rain it was an excellent vacation,"
"1689930089-23","https://www.tripadvisor.com/Hotel_Review-g150807-d152896-Reviews-or80-Hard_Rock_Hotel_Cancun-Cancun_Yucatan_Peninsula.html#REVIEWS","7","https://www.tripadvisor.com/Hotel_Review-g150807-d152896-Reviews-or60-Hard_Rock_Hotel_Cancun-Cancun_Yucatan_Peninsula.html","The beds are super comfy and the pillows are the best! All the staff are lovely especially Goretti - she does the entertainment and is so lovely and always happy to help.  Would definitely recommend this hotel"
"1689930089-24","https://www.tripadvisor.com/Hotel_Review-g150807-d152896-Reviews-or80-Hard_Rock_Hotel_Cancun-Cancun_Yucatan_Peninsula.html#REVIEWS","7","https://www.tripadvisor.com/Hotel_Review-g150807-d152896-Reviews-or60-Hard_Rock_Hotel_Cancun-Cancun_Yucatan_Peninsula.html","The service at Hard Rock Cancun was amazing! Everyone was very friendly and attentive.   We had an amazing week. The building and grounds were immaculate. We loved the staff at the Smash Bar.  The bartenders were great!!"
"1689930089-25","https://www.tripadvisor.com/Hotel_Review-g150807-d152896-Reviews-or80-Hard_Rock_Hotel_Cancun-Cancun_Yucatan_Peninsula.html#REVIEWS","7","https://www.tripadvisor.com/Hotel_Review-g150807-d152896-Reviews-or60-Hard_Rock_Hotel_Cancun-Cancun_Yucatan_Peninsula.html","I was really annoyed the check in was so slow waiting for more than 15 minutes after long flights is not great. Room was nice but surprisingly dated for a relatively new hotel.  Very difficult to keep the suite at the right temperature."
"1689930089-26","https://www.tripadvisor.com/Hotel_Review-g150807-d152896-Reviews-or80-Hard_Rock_Hotel_Cancun-Cancun_Yucatan_Peninsula.html#REVIEWS","7","https://www.tripadvisor.com/Hotel_Review-g150807-d152896-Reviews-or60-Hard_Rock_Hotel_Cancun-Cancun_Yucatan_Peninsula.html","Got to say pretty underwhelmed after paying over 5k for 2 weeks.  Firstly staff,location,food and beach all superb.   Entertainment decent but bar options very poor ( there is no options only one lobby bar )    Trying to be fair I would imagine if you come for a short trip this would be sufficient but for 14 days it becomes monotonous especially as the entertainment staff never use 10 words where 100 will do and shout even though they have the use of a microohone.  Our biggest issue is the members tiers that Tui fail to warn you about and the reserving of every pool side bed for such members.   Don't get me wrong there's always beds available but it would be nice to get a front row bed near the pool bar but they all have owners nameplates on them from about 7am and towel station"
"1689930089-27","https://www.tripadvisor.com/Hotel_Review-g150807-d152896-Reviews-or80-Hard_Rock_Hotel_Cancun-Cancun_Yucatan_Peninsula.html#REVIEWS","7","https://www.tripadvisor.com/Hotel_Review-g150807-d152896-Reviews-or60-Hard_Rock_Hotel_Cancun-Cancun_Yucatan_Peninsula.html","The front desk of the Hard Rock has no idea what they are doing. They never answer their calls before  you check in to make any accommodations prior to your arrival they just transfer you from department to department and none answer. Upon arrival everyone only the bell man are nice, other staff and managers don't treat guests with hospitality. We never received the 1 bedroom room requested and to top it off were placed in a room with a view to the a/c unit. They did nothing to make our stay welcome in the 4 days we stayed there. The food in the buffet is reused daily no variety. If you are not purchasing one of their timeshare properties with Hard Rock you get treated like a regular guest not VIP."
"1689930089-28","https://www.tripadvisor.com/Hotel_Review-g150807-d152896-Reviews-or80-Hard_Rock_Hotel_Cancun-Cancun_Yucatan_Peninsula.html#REVIEWS","7","https://www.tripadvisor.com/Hotel_Review-g150807-d152896-Reviews-or60-Hard_Rock_Hotel_Cancun-Cancun_Yucatan_Peninsula.html","We stayed 8 days and had an amazing time there, food is really good, rooms and all areas are very clean. Staff is very friendly and helpful. There is also a lot of activities in the pool, bars and theatre everyday"
"1689930089-29","https://www.tripadvisor.com/Hotel_Review-g150807-d152896-Reviews-or80-Hard_Rock_Hotel_Cancun-Cancun_Yucatan_Peninsula.html#REVIEWS","7","https://www.tripadvisor.com/Hotel_Review-g150807-d152896-Reviews-or60-Hard_Rock_Hotel_Cancun-Cancun_Yucatan_Peninsula.html","Food and amenities were great the customer service was outstanding. The only concerns the anniversary package that was approved with my online purchase was not added to our room and the extras that come with it. Other than that the best customer service and a beautiful hotel to stay. Would highly recommend."
"1689930089-30","https://www.tripadvisor.com/Hotel_Review-g150807-d152896-Reviews-or80-Hard_Rock_Hotel_Cancun-Cancun_Yucatan_Peninsula.html#REVIEWS","7","https://www.tripadvisor.com/Hotel_Review-g150807-d152896-Reviews-or60-Hard_Rock_Hotel_Cancun-Cancun_Yucatan_Peninsula.html","We stayed at the Hard Rock Hotel  for our 24th wedding anniversary. Hotel and rooms were always clean, great service and staff was friendly. Room service was always fast.  Mixed drinks were delicious. Food was good, my favorite restaurant was Ciao- never disappointed. On our 3rd night, the hotel surprised us by delivering a bottle of wine and chocolate covered strawberries to our room for our anniversary. Only downside was that walls were paper thin, I could hear people in other rooms talking. Overall we had a great experience, will definitely be staying there again."
"1689930089-31","https://www.tripadvisor.com/Hotel_Review-g150807-d152896-Reviews-or80-Hard_Rock_Hotel_Cancun-Cancun_Yucatan_Peninsula.html#REVIEWS","7","https://www.tripadvisor.com/Hotel_Review-g150807-d152896-Reviews-or60-Hard_Rock_Hotel_Cancun-Cancun_Yucatan_Peninsula.html","Just finished a great week at the hard rock Cancun. We enjoyed the infinity pool overlooking the ocean how easy it was to access activities and restaurants. Jessy and Alexis were great and helped us feel welcome with special treats in the room and chairs on the beach. One of the most memorable things from our week was a room service dinner on the balcony  with Chac and watching sea turtles while we ate."
"1689930145-32","https://www.tripadvisor.com/Hotel_Review-g150807-d152896-Reviews-Hard_Rock_Hotel_Cancun-Cancun_Yucatan_Peninsula.html","6","https://www.tripadvisor.com/Hotel_Review-g150807-d152896-Reviews-or50-Hard_Rock_Hotel_Cancun-Cancun_Yucatan_Peninsula.html","Let’s start with the best part of it the butler Jessie is amazing I wish she had better tools at this facility. Place is in serious need of updates and better food and Drinks. A/C is horrible in all areas except in the entrance. It’s a small resort family resort very busy. The pools all need updates our friend cut her foot."
"1689930145-33","https://www.tripadvisor.com/Hotel_Review-g150807-d152896-Reviews-Hard_Rock_Hotel_Cancun-Cancun_Yucatan_Peninsula.html","6","https://www.tripadvisor.com/Hotel_Review-g150807-d152896-Reviews-or50-Hard_Rock_Hotel_Cancun-Cancun_Yucatan_Peninsula.html","Special note on the customer service given throughout our whole stay at this hotel. The kindness and going the extra mile by all the staff at this hotel is incredible. Our favorite restaurant was Frida and most favorite waiters at this one particular location were Iván and Carlos. Not only they they were happy to serve us but went beyond in giving us suggestions and advice on all sorts of information regarding food and drinks. Our room was located on the 10th floor and the views were spectacular as well as very clean and comfortable. We definitely recommend this hotel to anyone traveling with families and friends who are looking to be in one of the best spots in the hotel area in Cancun."
