web-scraper-order,web-scraper-start-url,pages,pages-href,reviews
"1689912770-68","https://www.tripadvisor.com/Hotel_Review-g150807-d642781-Reviews-or80-Hyatt_Zilara_Cancun-Cancun_Yucatan_Peninsula.html","8","https://www.tripadvisor.com/Hotel_Review-g150807-d642781-Reviews-or70-Hyatt_Zilara_Cancun-Cancun_Yucatan_Peninsula.html","Property looks rundown . Alcoholic beverages are mediocre to average at best . Breakfast and dinner were alright . This is probably a 3 1/2 star resort at best . Staff is really friendly and helpful. Entertainment at night is below average ."
"1689912770-69","https://www.tripadvisor.com/Hotel_Review-g150807-d642781-Reviews-or80-Hyatt_Zilara_Cancun-Cancun_Yucatan_Peninsula.html","8","https://www.tripadvisor.com/Hotel_Review-g150807-d642781-Reviews-or70-Hyatt_Zilara_Cancun-Cancun_Yucatan_Peninsula.html","I was at the hotel for 2 nights doing a site tour/inspection for our 2024 company trip.  The staff was great and my contact Marisol Alonso was awesome!  She spent so much time with me on the tour and answering questions before I even asked.  She was very personable and accommodating and there to help me with whatever I needed during my 2 days!    The hotel has so much to offer with activities.  There really isn't a need to leave.  :-)  The resort was very clean and the food was very good.    I would definitely recommend this resort to anyone going to Cancun."
"1689912770-70","https://www.tripadvisor.com/Hotel_Review-g150807-d642781-Reviews-or80-Hyatt_Zilara_Cancun-Cancun_Yucatan_Peninsula.html","8","https://www.tripadvisor.com/Hotel_Review-g150807-d642781-Reviews-or70-Hyatt_Zilara_Cancun-Cancun_Yucatan_Peninsula.html","After my 3rd trip to the Hyatt Zilara Cancun, I would return in a heartbeat.  The resort is located on a beautiful stretch of turquoise blue water in the Gulf of Mexico.  From the moment you step out of your shuttle, the David John will greet you and gladly help you with your luggage and where to check in and check out.  The rooms are all facing the ocean and accommodated with a large tub and separate shower that has great water pressure.  The food was all excellent, but our favorite restaurant was Asiana where Juan was our favorite server.  Palma was a gracious manager at Asiana that took the time out of his busy evening to take a picture of my wife and I.  Our favorite server was at Spice (the buffet), where Luise Alfonso greeted us every day even when we did not sit in his"
"1689912789-71","https://www.tripadvisor.com/Hotel_Review-g150807-d642781-Reviews-or80-Hyatt_Zilara_Cancun-Cancun_Yucatan_Peninsula.html","7","https://www.tripadvisor.com/Hotel_Review-g150807-d642781-Reviews-or60-Hyatt_Zilara_Cancun-Cancun_Yucatan_Peninsula.html","The Hyatt Zilara offers a truly relaxing and enjoyable experience. A spacious pool, good food and drinks, clean and well-appointed rooms—all made possible by their amazing staff. For anyone looking for a wellness experience, I highly recommend Pepe’s morning yoga and abs workout to start your day—right there under the gazebo facing the ocean. Follow up with breakfast at Punta Vista! And even if you think a foam party isn’t your thing, go to it anyway. It’s a blast, and the entertainment team is awesome."
"1689912789-72","https://www.tripadvisor.com/Hotel_Review-g150807-d642781-Reviews-or80-Hyatt_Zilara_Cancun-Cancun_Yucatan_Peninsula.html","7","https://www.tripadvisor.com/Hotel_Review-g150807-d642781-Reviews-or60-Hyatt_Zilara_Cancun-Cancun_Yucatan_Peninsula.html","Best hotel I ever stayed at! Do not question staying here. Will definitely return. Food was amazing. I have absolutely no complaints about my stay expect that I wished I stayed longer. We cannot stop talking about our stay to our family. Amazing time!!!"
"1689912789-73","https://www.tripadvisor.com/Hotel_Review-g150807-d642781-Reviews-or80-Hyatt_Zilara_Cancun-Cancun_Yucatan_Peninsula.html","7","https://www.tripadvisor.com/Hotel_Review-g150807-d642781-Reviews-or60-Hyatt_Zilara_Cancun-Cancun_Yucatan_Peninsula.html","This was our 2nd time here and won’t be the last!  We were pampered the entire week and recommend Hyatt Zilara to anyone going to Cancun! Beautiful surroundings and the kindest people you will ever meet!"
"1689912789-74","https://www.tripadvisor.com/Hotel_Review-g150807-d642781-Reviews-or80-Hyatt_Zilara_Cancun-Cancun_Yucatan_Peninsula.html","7","https://www.tripadvisor.com/Hotel_Review-g150807-d642781-Reviews-or60-Hyatt_Zilara_Cancun-Cancun_Yucatan_Peninsula.html","Muy bien…excelente…we truly enjoyed our 4 night stay.  Friendly, attentivestaff everywhere, which was refreshing coming from the US where we’ve been conditioned to expect mediocre to poor service.  Food, drinks, evening shows were all above average.  The only lowlight for me was the cabanas.  Even if you go down at 6 am, the  better “complimentary” cabanas are somehow already takem.  Do yourself a favor and reserve the cabana you want (marked “for rent”) at least one day during your stay.  There are plenty open on the beach as well.  The gym is one of the best hotel gyms I’ve ever used - and there are many fitness activities available.  Great place to go for a good time!"
"1689912789-75","https://www.tripadvisor.com/Hotel_Review-g150807-d642781-Reviews-or80-Hyatt_Zilara_Cancun-Cancun_Yucatan_Peninsula.html","7","https://www.tripadvisor.com/Hotel_Review-g150807-d642781-Reviews-or60-Hyatt_Zilara_Cancun-Cancun_Yucatan_Peninsula.html","This hotel is stunning, from the gorgeous views to the amazing staff and never ending food and drinks I can not say enough wonderful things. Our first day there my husband said we will be back and I absolutely will hold him to that!!"
"1689912789-76","https://www.tripadvisor.com/Hotel_Review-g150807-d642781-Reviews-or80-Hyatt_Zilara_Cancun-Cancun_Yucatan_Peninsula.html","7","https://www.tripadvisor.com/Hotel_Review-g150807-d642781-Reviews-or60-Hyatt_Zilara_Cancun-Cancun_Yucatan_Peninsula.html","We visited with another couple and this resort exceeded our expectations! Food was excellent everywhere! Pool and beach area is beautiful. The staff was so nice and helpful!  The spa area is beautiful. Will definitely be back!"
"1689912789-77","https://www.tripadvisor.com/Hotel_Review-g150807-d642781-Reviews-or80-Hyatt_Zilara_Cancun-Cancun_Yucatan_Peninsula.html","7","https://www.tripadvisor.com/Hotel_Review-g150807-d642781-Reviews-or60-Hyatt_Zilara_Cancun-Cancun_Yucatan_Peninsula.html","This was a true 5 star experience! From check-in to check-out! The food and drinks were amazing, everyone was so nice and helpful, and the property is absolutely beautiful. I highly recommend this place for your next vacation. Prepare to be amazed and have a once in a lifetime experience!"
"1689912789-78","https://www.tripadvisor.com/Hotel_Review-g150807-d642781-Reviews-or80-Hyatt_Zilara_Cancun-Cancun_Yucatan_Peninsula.html","7","https://www.tripadvisor.com/Hotel_Review-g150807-d642781-Reviews-or60-Hyatt_Zilara_Cancun-Cancun_Yucatan_Peninsula.html","From a quick check in, to a lovely room with fab views, to plenty of food options and any drink you crave. Friendly and fast service. The rooms were spacious and clean. The outdoor pool and amenities superb! Highly recommend!"
"1689912789-79","https://www.tripadvisor.com/Hotel_Review-g150807-d642781-Reviews-or80-Hyatt_Zilara_Cancun-Cancun_Yucatan_Peninsula.html","7","https://www.tripadvisor.com/Hotel_Review-g150807-d642781-Reviews-or60-Hyatt_Zilara_Cancun-Cancun_Yucatan_Peninsula.html","My husband and I came here right after our wedding for our honeymoon. We love staying at Hyatt Resorts but this one was our favorite! The space is breathtaking - right on the beach, then oversees the bay on the other side of the resort (the sunsets as we ate dinners were beautiful looking over that bay). We absolutely LOVED all the food! I have celiac disease and they accommodated my gluten-free dietary needs so well. There was great variety in food options - all of it done so well. A highlight was doing Pilates with Diana in the SkyGym at the resort. So fun to have Pilates reformers right there, with such a great instructor! All of the staff helped to make the stay so wonderful. We will definitely be coming back!"
"1689912789-80","https://www.tripadvisor.com/Hotel_Review-g150807-d642781-Reviews-or80-Hyatt_Zilara_Cancun-Cancun_Yucatan_Peninsula.html","7","https://www.tripadvisor.com/Hotel_Review-g150807-d642781-Reviews-or60-Hyatt_Zilara_Cancun-Cancun_Yucatan_Peninsula.html","This place is Awesome with the staff to match. Everyone was nice and accommodating. The food and menu could use a little work but we were satisfied overall. The location is walking distance to the mall and a short bus ride from everything else. We will return to this location."
"1689912826-81","https://www.tripadvisor.com/Hotel_Review-g150807-d642781-Reviews-Hyatt_Zilara_Cancun-Cancun_Yucatan_Peninsula.html","6","https://www.tripadvisor.com/Hotel_Review-g150807-d642781-Reviews-or50-Hyatt_Zilara_Cancun-Cancun_Yucatan_Peninsula.html","My daughter and I escaped to this dreamy resort for her grad school graduation gift. If you are on the fence about choosing this place, DONT BE! So many pluses, where do I start. The customer service we received was outstanding and genuine. Always felt welcome and staff were kind, helpful and smiling. Charly was the activities director and made our days fun, and the pool bartenders were attentive as well as the girl who waited on us at our cabana daily…she was super friendly! Ricardo at The Den was so knowledgeable and our cocktails were fantastic (great sunset out of the back French doors).  The food was awesome, the coffee shop guys so sweet (and the ham panini was amazing!) We loved Spice, always an enormous selection and the waitstaff lovely (the shrimp ceviche was to die"
"1689912826-82","https://www.tripadvisor.com/Hotel_Review-g150807-d642781-Reviews-Hyatt_Zilara_Cancun-Cancun_Yucatan_Peninsula.html","6","https://www.tripadvisor.com/Hotel_Review-g150807-d642781-Reviews-or50-Hyatt_Zilara_Cancun-Cancun_Yucatan_Peninsula.html","Everything about this hotel is great! I am a foodie who travels to Barbados for half the year so please know when I tell you it was great, it was. The buffet had a myriad of options (hack: ask for breakfast tacos at the omelet station and bring all the ingredients you want included with you. They'll make you fresh tortillas!). My FAVORITE was a fresh fish station available for both lunch and dinner where you select a fish and it is prepared expertly on the griddle! As a pescatarian that was a TREMENDOUS option that had me on plan the entire time! Also, the gym is spectacular! More machines than you are probably used to in a resort, free weights, and a myriad of yoga, abs and water aerobic classes. The gym even has its own lap pool. We also participated in the included wine"
"1689912826-83","https://www.tripadvisor.com/Hotel_Review-g150807-d642781-Reviews-Hyatt_Zilara_Cancun-Cancun_Yucatan_Peninsula.html","6","https://www.tripadvisor.com/Hotel_Review-g150807-d642781-Reviews-or50-Hyatt_Zilara_Cancun-Cancun_Yucatan_Peninsula.html","This resort could not have been more perfect. It was beautiful and clean. The food and drinks were fantastic. I can't say enough positive things about the staff. They were AMAZING! I did not get but a few last names. But, they all deserve the best: Alonzo Ugalde, Carlos Cruz, Noah, Daniel, Luis, Phelipe, Jorge, Humberto and Janett. There were more amazing people, but these are all that I can remember at the moment.  I hope to return to my new favorite place on Earth!"
"1689912826-84","https://www.tripadvisor.com/Hotel_Review-g150807-d642781-Reviews-Hyatt_Zilara_Cancun-Cancun_Yucatan_Peninsula.html","6","https://www.tripadvisor.com/Hotel_Review-g150807-d642781-Reviews-or50-Hyatt_Zilara_Cancun-Cancun_Yucatan_Peninsula.html","This resort was amazing! I enjoyed the adult only atmosphere; however, the lack of late night activities for adults was disappointing to us. Everything shut down at 11, which made us feel like we had a curfew on vacation. The rooms and the pool were amazing. We loved the jetted tub and hammock. The food and service far exceeded our expectations."
"1689912826-85","https://www.tripadvisor.com/Hotel_Review-g150807-d642781-Reviews-Hyatt_Zilara_Cancun-Cancun_Yucatan_Peninsula.html","6","https://www.tripadvisor.com/Hotel_Review-g150807-d642781-Reviews-or50-Hyatt_Zilara_Cancun-Cancun_Yucatan_Peninsula.html","This was the perfect get away! The hotel was beautiful and clean. The staff is amazing! They truly go the extra mile to make sure you are given the best service. Humberto and Carlos Cruz were outstanding!!!! Remembered our names and remembered what we were drinking and had it ready before we asked for a refill!  Can not wait to come back!!!!!"
"1689912826-86","https://www.tripadvisor.com/Hotel_Review-g150807-d642781-Reviews-Hyatt_Zilara_Cancun-Cancun_Yucatan_Peninsula.html","6","https://www.tripadvisor.com/Hotel_Review-g150807-d642781-Reviews-or50-Hyatt_Zilara_Cancun-Cancun_Yucatan_Peninsula.html","They treated us like we were not able to afford to stay in this Resort- The staff kept asking us where were we going, asking for our room numbers and details, publicly without privacy. They ever tried to scam us to purchase a whole bottle of tequila by telling us a different price. We also experience spoiled food that was served by the waiter on purpose. The worst hyatt stay i ever experienced"
"1689912826-87","https://www.tripadvisor.com/Hotel_Review-g150807-d642781-Reviews-Hyatt_Zilara_Cancun-Cancun_Yucatan_Peninsula.html","6","https://www.tripadvisor.com/Hotel_Review-g150807-d642781-Reviews-or50-Hyatt_Zilara_Cancun-Cancun_Yucatan_Peninsula.html","Absolutely nothing to critique! They greeted us each day with an email about the day's activities which were interesting and fun. The food was stellar, the service was impeccable, the staff were always gracious and attentive. The concierge staff were the best I've ever had the pleasure to meet. The pool was large and inviting with a swim-up bar. The very definition of ""fun in the sun""!  Outstanding!"
"1689912826-88","https://www.tripadvisor.com/Hotel_Review-g150807-d642781-Reviews-Hyatt_Zilara_Cancun-Cancun_Yucatan_Peninsula.html","6","https://www.tripadvisor.com/Hotel_Review-g150807-d642781-Reviews-or50-Hyatt_Zilara_Cancun-Cancun_Yucatan_Peninsula.html","Fabulous night at the Asiana. Special thanks to Bonnie our waitress and Juan the sommelier who helped us chose a truly lovely wine. Amazing recovery for a restaurant who has lost our booking! Looking forward to tomorrow night where we will be trying the special fusion menu"
"1689912826-89","https://www.tripadvisor.com/Hotel_Review-g150807-d642781-Reviews-Hyatt_Zilara_Cancun-Cancun_Yucatan_Peninsula.html","6","https://www.tripadvisor.com/Hotel_Review-g150807-d642781-Reviews-or50-Hyatt_Zilara_Cancun-Cancun_Yucatan_Peninsula.html","Overall good but could have been better. Like many we watched YouTube video reviews, they are not exactly correct here’s why…if you don’t purchase a cabana your free ones will be low quality and no views, the buffet is small and very limited on what they offer, the balcony has privacy wall on one side but not the other so no friendly time with wife without risk of neighbors walking out on their balcony, no snacks at beach bar, pizza place was hidden (we didn’t even know it was there until our last day), constant humming coming from pool side restaurant 24 Hrs which will give you a headache from your balcony, lobby is not air conditioned which makes any nightly show to hot to enjoy….. the service was great, food taste was great, security was great, cleanliness was great… like I"
"1689912826-90","https://www.tripadvisor.com/Hotel_Review-g150807-d642781-Reviews-Hyatt_Zilara_Cancun-Cancun_Yucatan_Peninsula.html","6","https://www.tripadvisor.com/Hotel_Review-g150807-d642781-Reviews-or50-Hyatt_Zilara_Cancun-Cancun_Yucatan_Peninsula.html","This was the best vacation ever! The service, the food, the staff, the hotel everything about this place was top notch! This is worth the money, and this is worth visiting! I cannot tell you how happy my wife and I are! We also met some great friends here on the trip! Everything about this hotel is amazing!!!!!!!! we have never ever been treated like this ever at any resort! The staff is amazing. The service is amazing and the food was phenomenal.!!! Lots of fun and definitely worth it!!!"
"1689912845-91","https://www.tripadvisor.com/Hotel_Review-g150807-d642781-Reviews-Hyatt_Zilara_Cancun-Cancun_Yucatan_Peninsula.html","5","https://www.tripadvisor.com/Hotel_Review-g150807-d642781-Reviews-or40-Hyatt_Zilara_Cancun-Cancun_Yucatan_Peninsula.html","We essentially never left the resort except for a Dolphin excursion and returned relaxed and ready to get back at it!  Spa was peaceful & wonderful. The double decker cabanas were worth every penny as we like our privacy.  So much room and constant food/beverage services. We loved it!"
"1689912845-92","https://www.tripadvisor.com/Hotel_Review-g150807-d642781-Reviews-Hyatt_Zilara_Cancun-Cancun_Yucatan_Peninsula.html","5","https://www.tripadvisor.com/Hotel_Review-g150807-d642781-Reviews-or40-Hyatt_Zilara_Cancun-Cancun_Yucatan_Peninsula.html","I will have to say the property itself is great, and the staff are absolutely fantastic. It’s a little dated, but the rooms are large, and I loved the balcony with the hammock in our room. The pool area and beach are great too.   We visited over the 4th of July week (my birthday) and the staff decorated my room for my birthday. They had a barbecue with live entertainment, acrobats, fire dancers, and fireworks. It was well put together and great entertainment. We always had fantastic interactions with the staff.   I will have to say, in terms of food, sometimes it was just “ok” and a lot of the time we were served food that was completely inedible. We got sick from the food immediately after the first night and we are still feeling the effects 3 days after we have come home. It"
"1689912845-93","https://www.tripadvisor.com/Hotel_Review-g150807-d642781-Reviews-Hyatt_Zilara_Cancun-Cancun_Yucatan_Peninsula.html","5","https://www.tripadvisor.com/Hotel_Review-g150807-d642781-Reviews-or40-Hyatt_Zilara_Cancun-Cancun_Yucatan_Peninsula.html","Aside from the breakfast, every meal that my group had (12 dudes) was absolutely horrid. The fruit was a joke, the hamburgers were reheated slop, and the seafood genuinely made us sick. Also, this is the only ""5 star"" all-inclusive resort I have stayed at that did not offer bottles of liquor in the room refilled daily."
"1689912845-94","https://www.tripadvisor.com/Hotel_Review-g150807-d642781-Reviews-Hyatt_Zilara_Cancun-Cancun_Yucatan_Peninsula.html","5","https://www.tripadvisor.com/Hotel_Review-g150807-d642781-Reviews-or40-Hyatt_Zilara_Cancun-Cancun_Yucatan_Peninsula.html","I have visited Mexico several times and stayed at many different hotels. This is by far the most expensive of all trips. The rooms smelled like old sewage. The drinks were watered down- absolutely no alcohol in them. The food portions (aside from Spice) were so tiny!! There was an upcharge for EVERYTHING. It was the worst and most expensive experience I've ever had in Mexico!!"
"1689912845-95","https://www.tripadvisor.com/Hotel_Review-g150807-d642781-Reviews-Hyatt_Zilara_Cancun-Cancun_Yucatan_Peninsula.html","5","https://www.tripadvisor.com/Hotel_Review-g150807-d642781-Reviews-or40-Hyatt_Zilara_Cancun-Cancun_Yucatan_Peninsula.html","I normally stay close to home for 4th of July, but was blow away how this exceptional Adults Only Hotel & Spa was off the charts converting everything to Red White & Blue for us all 🇺🇸, including all day 4th of July Theme.   Just awesome and well thought out! Not just fireworks but much more!   Thank you,  We will be back…"
"1689912845-96","https://www.tripadvisor.com/Hotel_Review-g150807-d642781-Reviews-Hyatt_Zilara_Cancun-Cancun_Yucatan_Peninsula.html","5","https://www.tripadvisor.com/Hotel_Review-g150807-d642781-Reviews-or40-Hyatt_Zilara_Cancun-Cancun_Yucatan_Peninsula.html","I love coming back to this hotel.  It feels like a home away from home.  Here, everything is closed by.  You can be at the beach, pool, restaurants in no time.  The views from every room are amazing.    The staff keeps going above and beyond to make it a special stay for everyone.  Eloísa, Arturo, Eduardo and Ligia are like family to us.  The managers like Juan and Carlos are always checking with guests to see if we are having a good time.  Every morning I look forward to go get my coffee from Enrique, Abigail and Jose.  They just work really hard and are really pleasant to everyone.    The shows are amazing and new."
"1689912845-97","https://www.tripadvisor.com/Hotel_Review-g150807-d642781-Reviews-Hyatt_Zilara_Cancun-Cancun_Yucatan_Peninsula.html","5","https://www.tripadvisor.com/Hotel_Review-g150807-d642781-Reviews-or40-Hyatt_Zilara_Cancun-Cancun_Yucatan_Peninsula.html","Way to ruin our honeymoon, construction taking place throughout the whole time; but the team didn't think that would be important to advise prior to a 40 hour commute. Constant drilling and hammering outside our room and nearby the pool & beach - could not relax at all that we checked out after 24 hours! A number of things in the room also did not work, air-conditioner leaked directly onto desk, tv channels zoning out, and no wonder it's all inclusive - food quality is less than par! We were celebrating our honeymoon, and it just felt like a regular check in (was asked 4 times if we were celebrating anything even though it was on the booking) we weren't looking for superstar treatment, but a bottle of champagne or at least a nice message on the bed upon arrival wouldn't have"
"1689912845-98","https://www.tripadvisor.com/Hotel_Review-g150807-d642781-Reviews-Hyatt_Zilara_Cancun-Cancun_Yucatan_Peninsula.html","5","https://www.tripadvisor.com/Hotel_Review-g150807-d642781-Reviews-or40-Hyatt_Zilara_Cancun-Cancun_Yucatan_Peninsula.html","I recently stayed at the Hyatt Zilara and the stay was wonderful! First of all, the hotel staff are ALL so attentive, kind and helpful. Seriously, can’t say enough good things about them. The food was pretty good, areas of improvement for sure but better than I expected. The drinks were also great but could use better alcohol in them."
"1689912845-99","https://www.tripadvisor.com/Hotel_Review-g150807-d642781-Reviews-Hyatt_Zilara_Cancun-Cancun_Yucatan_Peninsula.html","5","https://www.tripadvisor.com/Hotel_Review-g150807-d642781-Reviews-or40-Hyatt_Zilara_Cancun-Cancun_Yucatan_Peninsula.html","I first would like to say that I was very sad when it was time to leave after a week stay.  Hyatt Zilara Cancun gave me the experience I never knew I was missing.   The location was perfect, just 25 minutes or less from the airport, so we were there in no time.  This is an oceanfront resort with ALL rooms having a view of the ocean (no upcharge).   PROs: The Service—by far the best service I have ever received abroad or even in the U.S. The SERVICE is what separates this resort from all other resorts.  From the bell boy to the maintenance crew, if they saw you at anytime of the day, they would put their hand over their heart, smile and greet you.  They made you feel welcomed and as if you were family.  NEVER in the entire week did this not happen at any place I step my foot in."
"1689912845-100","https://www.tripadvisor.com/Hotel_Review-g150807-d642781-Reviews-Hyatt_Zilara_Cancun-Cancun_Yucatan_Peninsula.html","5","https://www.tripadvisor.com/Hotel_Review-g150807-d642781-Reviews-or40-Hyatt_Zilara_Cancun-Cancun_Yucatan_Peninsula.html","We're so grateful to have stayed at Zilara, not only for the beautiful beach, hotel, rooms and location, but for the many employees that make it possible. From the maids to waiters, bartenders to the maintenance team, the entertainers and management, everyone is amazing and it makes the experience worth it."
"1689912864-101","https://www.tripadvisor.com/Hotel_Review-g150807-d642781-Reviews-Hyatt_Zilara_Cancun-Cancun_Yucatan_Peninsula.html","4","https://www.tripadvisor.com/Hotel_Review-g150807-d642781-Reviews-or30-Hyatt_Zilara_Cancun-Cancun_Yucatan_Peninsula.html","My wife and I had a great experience at Hyatt Zilara.  My wife is pregnant and also has a gluten allergy. All the staff did a great job accommodating us and preparing gluten friendly meals and options, all we had to do was ask.  We spent most of our visit at the beach , never had an issue getting a free cabana.  No need to rush and place towels , beach chairs and cabana were available all day.  Luis was a great server on the beach, always checking to make sure we had lots of water and never had an empty hand.   The pool was way to warm , more like a bath tub. We did go in twice for a short swim , but not where we were interested in hanging out.  Pool chairs did get claimed early.   Punta Vista was our favourite restaurant where Marco was always smiling and happy to see us and"
"1689912864-102","https://www.tripadvisor.com/Hotel_Review-g150807-d642781-Reviews-Hyatt_Zilara_Cancun-Cancun_Yucatan_Peninsula.html","4","https://www.tripadvisor.com/Hotel_Review-g150807-d642781-Reviews-or30-Hyatt_Zilara_Cancun-Cancun_Yucatan_Peninsula.html","My wife and I, along with 2 other couples, were all celebrating turning 40.  The Zilara had great service and great food! The rooms were clean and comfortable.  We all had a great time and are hoping to be back in the near future."
