web-scraper-order,web-scraper-start-url,pages,pages-href,reviews
"1689912698-31","https://www.tripadvisor.com/Hotel_Review-g150807-d642781-Reviews-or130-Hyatt_Zilara_Cancun-Cancun_Yucatan_Peninsula.html","12","https://www.tripadvisor.com/Hotel_Review-g150807-d642781-Reviews-or110-Hyatt_Zilara_Cancun-Cancun_Yucatan_Peninsula.html","WOW! This is by far the best hotel/resort experience I had in the Cancun area.  What did it make it so special? The people who work there! All the staff are AMAZING; from the front-desk clerks, to the servers, bartenders, entertainment and fitness staff, everyone we encounter delivered top-notch service. No matter what you need, they are there to help. I felt welcomed at all times.  THE LOCATION  Located at the popular Hotel Zone, access was easy from the airport. We used a private transportation company and booked ahead, but it is also possible to take a taxi (less than 20 min ride).  All the rooms are facing the ocean. The views are incredible! Turquoise waters and clear sands. I loved my morning walks on the beach!  THE FOOD  There are a few restaurants at the hotel, as well"
"1689912698-32","https://www.tripadvisor.com/Hotel_Review-g150807-d642781-Reviews-or130-Hyatt_Zilara_Cancun-Cancun_Yucatan_Peninsula.html","12","https://www.tripadvisor.com/Hotel_Review-g150807-d642781-Reviews-or110-Hyatt_Zilara_Cancun-Cancun_Yucatan_Peninsula.html","The hotel is beautiful and delivers high quality service for their guest. We loved our stay. Everything was perfect, the customer service, room comfort and condition, and the food was exceptional. A big thank you to Jesus from Spice and chef Eliazar! They were great and able to satisfy my husband’s and I’s breakfast cravings. I loved Jesus’s hospitality and service, he truly made our vacation memorable. We appreciated being treated like family, it really means a lot. Again thank you 😊 Hyatt Zilara we can’t wait to see you soon!"
"1689912698-33","https://www.tripadvisor.com/Hotel_Review-g150807-d642781-Reviews-or130-Hyatt_Zilara_Cancun-Cancun_Yucatan_Peninsula.html","12","https://www.tripadvisor.com/Hotel_Review-g150807-d642781-Reviews-or110-Hyatt_Zilara_Cancun-Cancun_Yucatan_Peninsula.html","Enrique and Jose were amazing at the Casa Del Cafe. Eloisa and Adrian great at the beach. Punta Vista host and waiters 5 stars. Only 2 stars for Buffet and Asian restaurant food. Too many cabanas, therefore not enough lounge chairs and umbrellas. Too much sales pressure at check in, for massage and other offers. Felt like exit at the airport. Amazing e-concierge service. Monica Zarate. My favorite drink was not available at the bars, they provided it. Nightly shows were amazing. 10 stars to all involved. Great housekeeping by Martha. We've dined at Punta Vista 3 of the 5 nights. i wished you had more open air restaurants."
"1689912698-34","https://www.tripadvisor.com/Hotel_Review-g150807-d642781-Reviews-or130-Hyatt_Zilara_Cancun-Cancun_Yucatan_Peninsula.html","12","https://www.tripadvisor.com/Hotel_Review-g150807-d642781-Reviews-or110-Hyatt_Zilara_Cancun-Cancun_Yucatan_Peninsula.html","We loved every single minute of our vacation. ALL of the staff were very friendly and helpful with our questions about excursions, where to shop, what to do, etc. The food and drinks were great! The view was awesome, and our room was impeccably clean. AC kept our room very cool. Easy to find  complimentary Cabana's and relaxed for hours! The resort atmosphere is more laid back, but was exactly what we were looking for to celebrate our 30th wedding anniversary. Would definitely go back."
"1689912698-35","https://www.tripadvisor.com/Hotel_Review-g150807-d642781-Reviews-or130-Hyatt_Zilara_Cancun-Cancun_Yucatan_Peninsula.html","12","https://www.tripadvisor.com/Hotel_Review-g150807-d642781-Reviews-or110-Hyatt_Zilara_Cancun-Cancun_Yucatan_Peninsula.html","By far the best travel experience from Hyatt Zilara staff from the time we arrived till we headed out. If you are looking for a carefree vacation with top notch quality, this your place! Modern, clean facility with a spectacular view and helpful staff!"
"1689912698-36","https://www.tripadvisor.com/Hotel_Review-g150807-d642781-Reviews-or130-Hyatt_Zilara_Cancun-Cancun_Yucatan_Peninsula.html","12","https://www.tripadvisor.com/Hotel_Review-g150807-d642781-Reviews-or110-Hyatt_Zilara_Cancun-Cancun_Yucatan_Peninsula.html","I can't say enough good things about this hotel, I just had the best time here. I do want to say that I am absolutely not a resort person who goes to an all-inclusive and spends all their time in the resort, doing the resort activities and hanging out by the beach all day. I spent a total of 8 days at this resort and half of those I was out the entire day.   The 4 days I did spend at the resort I mostly just hung out on my balcony (which was FANTASTIC) reading. I didn't do any resort activities, I didn't listen to any of the evening entertainment, etc. I did eat at the restaurants, which were all very very good. I did seriously enjoy my balcony, which was one of the ocean view balconies that has 2 loungers instead of a chair and a hammock (I would not have enjoyed the hammock,"
"1689912698-37","https://www.tripadvisor.com/Hotel_Review-g150807-d642781-Reviews-or130-Hyatt_Zilara_Cancun-Cancun_Yucatan_Peninsula.html","12","https://www.tripadvisor.com/Hotel_Review-g150807-d642781-Reviews-or110-Hyatt_Zilara_Cancun-Cancun_Yucatan_Peninsula.html","Great service all around, every one of the staff members were extremely accommodating and friendly! They were happy to assist with all our needs! They had excursions available to different places, and even had connections to parasailing and jet skis on the beach also. Lots of complimentary cabanas for us to use also on the beach and at the pool."
"1689912698-38","https://www.tripadvisor.com/Hotel_Review-g150807-d642781-Reviews-or130-Hyatt_Zilara_Cancun-Cancun_Yucatan_Peninsula.html","12","https://www.tripadvisor.com/Hotel_Review-g150807-d642781-Reviews-or110-Hyatt_Zilara_Cancun-Cancun_Yucatan_Peninsula.html","Overall it is a nice resort but much smaller in comparison to the Rose Hall resort in Jamaica and no not as nice as the Cap Cana resort in Punta Cana. The food.was good but the service was hit or miss. The rooms were smaller and somewhat dated. The biggest rip off was paying the higher fee to rent a cabana. The service was terrible and you could do everything yourself for no cost in the free cabanas. Just get there early."
"1689912698-39","https://www.tripadvisor.com/Hotel_Review-g150807-d642781-Reviews-or130-Hyatt_Zilara_Cancun-Cancun_Yucatan_Peninsula.html","12","https://www.tripadvisor.com/Hotel_Review-g150807-d642781-Reviews-or110-Hyatt_Zilara_Cancun-Cancun_Yucatan_Peninsula.html","The resort was incredible! Gorgeous interior and exterior design, gorgeous beach, delicious food at all the restaurants, delicious drinks, really fun shows, and superb service! Will totally be a return customer."
"1689912698-40","https://www.tripadvisor.com/Hotel_Review-g150807-d642781-Reviews-or130-Hyatt_Zilara_Cancun-Cancun_Yucatan_Peninsula.html","12","https://www.tripadvisor.com/Hotel_Review-g150807-d642781-Reviews-or110-Hyatt_Zilara_Cancun-Cancun_Yucatan_Peninsula.html","I have been a Real Club member (now Hyatt) for 17 years. All Real club members are treated as average resort guests. They no longer have a Real member concierge on site. Pressing folks into switching to Hyatt program. Resort is average at best. Food quality and selection is average. Room are ok but beds are very hard.  Some remaining old staff are still excellent i. e. Pool butler, some serving staff. All in all I had 31 guests staying at the resort for granddaughters graduation celebration and family vacation. Overall I would give the Hyatt Zilara a three and half stars as it has gone down in quality over the years."
"1689912733-41","https://www.tripadvisor.com/Hotel_Review-g150807-d642781-Reviews-or80-Hyatt_Zilara_Cancun-Cancun_Yucatan_Peninsula.html","11","https://www.tripadvisor.com/Hotel_Review-g150807-d642781-Reviews-or100-Hyatt_Zilara_Cancun-Cancun_Yucatan_Peninsula.html","The staff was amazing.  Everyone was so nice and responsive.  The hotel itself was very clean and welcoming.  The food choices outstanding.   And the spa is unbelievable.  I would fly back down just to go to their spa!"
"1689912733-42","https://www.tripadvisor.com/Hotel_Review-g150807-d642781-Reviews-or80-Hyatt_Zilara_Cancun-Cancun_Yucatan_Peninsula.html","11","https://www.tripadvisor.com/Hotel_Review-g150807-d642781-Reviews-or100-Hyatt_Zilara_Cancun-Cancun_Yucatan_Peninsula.html","This is our second time staying at Hyatt Zilara.  It is amazing!  Great food, drinks, service and views!  The staff was attentive. The activities were fun.  Every room has a beautiful view.  One of the best spas ever!"
"1689912733-43","https://www.tripadvisor.com/Hotel_Review-g150807-d642781-Reviews-or80-Hyatt_Zilara_Cancun-Cancun_Yucatan_Peninsula.html","11","https://www.tripadvisor.com/Hotel_Review-g150807-d642781-Reviews-or100-Hyatt_Zilara_Cancun-Cancun_Yucatan_Peninsula.html","Everything about this resort exceeded my expectations. The staff was very friendly and attentive to our needs. The food was amazing and better than other resorts I’ve stayed at. The spa was INCREDIBLE and worth the splurge. Definitely going back soon!"
"1689912733-44","https://www.tripadvisor.com/Hotel_Review-g150807-d642781-Reviews-or80-Hyatt_Zilara_Cancun-Cancun_Yucatan_Peninsula.html","11","https://www.tripadvisor.com/Hotel_Review-g150807-d642781-Reviews-or100-Hyatt_Zilara_Cancun-Cancun_Yucatan_Peninsula.html","The hotel was very reasonably priced.  All the employees went out of their way to serve and help us.  Food was excellent with lots of options.  Pools were great! Beach access excellent. Amazing entertainment everyday at the pool and in the evenings in the main lobby.  No hidden billing surprises.  Will return for sure!"
"1689912733-45","https://www.tripadvisor.com/Hotel_Review-g150807-d642781-Reviews-or80-Hyatt_Zilara_Cancun-Cancun_Yucatan_Peninsula.html","11","https://www.tripadvisor.com/Hotel_Review-g150807-d642781-Reviews-or100-Hyatt_Zilara_Cancun-Cancun_Yucatan_Peninsula.html","Incredible resort with incredible staff. Our concierge Ana was prompt and friendly. Our room was always kept clean by Martha. The service truly made the experience. We had a fantastic time at Chefs Table with Noe and Mateo ."
"1689912733-46","https://www.tripadvisor.com/Hotel_Review-g150807-d642781-Reviews-or80-Hyatt_Zilara_Cancun-Cancun_Yucatan_Peninsula.html","11","https://www.tripadvisor.com/Hotel_Review-g150807-d642781-Reviews-or100-Hyatt_Zilara_Cancun-Cancun_Yucatan_Peninsula.html","We just got back from our honeymoon at The Hyatt Zilara Cancun. It was amazing! The service, beach, pool, everything was perfect. All staff was so friendly and went above and beyond for any needs. Would  stay here again!"
"1689912733-47","https://www.tripadvisor.com/Hotel_Review-g150807-d642781-Reviews-or80-Hyatt_Zilara_Cancun-Cancun_Yucatan_Peninsula.html","11","https://www.tripadvisor.com/Hotel_Review-g150807-d642781-Reviews-or100-Hyatt_Zilara_Cancun-Cancun_Yucatan_Peninsula.html","Just wanted to share my experience  at Hyatt Zilara Cancun. This was one of the best vacations I have ever been on. The location is ideal as it took 17 minutes to travel to the resort from the airport. I used USA Transfers for this and they were very professional and easy to use. The resort welcomed us in their beautiful lobby (if you have seen the movie Barb and Star Go To Vista Del Mar this is where it was filmed).  I love to workout so we went to the gym daily. It has cardio equipment, free weights and machines, a pilates studio, an outdoor lap pool and lounging area, as well as kettlebells and steps. Pepe and Diana are the fitness e-team and they are the most amazing, dedicated, and professional team I have ever met. They love what they do and they are so happy to share"
"1689912733-48","https://www.tripadvisor.com/Hotel_Review-g150807-d642781-Reviews-or80-Hyatt_Zilara_Cancun-Cancun_Yucatan_Peninsula.html","11","https://www.tripadvisor.com/Hotel_Review-g150807-d642781-Reviews-or100-Hyatt_Zilara_Cancun-Cancun_Yucatan_Peninsula.html","The resort was wonderful! Great rooms, I felt very safe and so many things to do. Diana let great workouts. Eddie gave us a great tour of the spa. Charley lead great games and activities at the pool. I would recommend coming here!!"
"1689912733-49","https://www.tripadvisor.com/Hotel_Review-g150807-d642781-Reviews-or80-Hyatt_Zilara_Cancun-Cancun_Yucatan_Peninsula.html","11","https://www.tripadvisor.com/Hotel_Review-g150807-d642781-Reviews-or100-Hyatt_Zilara_Cancun-Cancun_Yucatan_Peninsula.html","absolutely spectacular couples and family experience.  Truly has a culture of service. We felt like royalty.  Alfredo and Javier are the best!  Get to know the team in the coffee shop; they are so special!"
"1689912733-50","https://www.tripadvisor.com/Hotel_Review-g150807-d642781-Reviews-or80-Hyatt_Zilara_Cancun-Cancun_Yucatan_Peninsula.html","11","https://www.tripadvisor.com/Hotel_Review-g150807-d642781-Reviews-or100-Hyatt_Zilara_Cancun-Cancun_Yucatan_Peninsula.html","This resort has the best staff I've ever experienced, they will go above & beyond to ensure you are taken care of.  Some of the rooms are dated, however they are very clean and add personal touches. We went with a group of 11 and really enjoyed ourselves. I would rent a cabana every day and ensure you participate in the foam pool party!"
"1689912751-51","https://www.tripadvisor.com/Hotel_Review-g150807-d642781-Reviews-or80-Hyatt_Zilara_Cancun-Cancun_Yucatan_Peninsula.html","10","https://www.tripadvisor.com/Hotel_Review-g150807-d642781-Reviews-or90-Hyatt_Zilara_Cancun-Cancun_Yucatan_Peninsula.html","Beautiful resort but more beautiful are the crew members at the Zilara. We had a wonderful week celebrating my comadres 40th birthday. Michell and Ana were very sweet and came by often. I appreciate the daily alerts and messages with information and activities schedules. Thank you.   PUNTA VISTA: shoutout to Valdemar who received us at our first lunch with hospitality and great recommendations. He was kind and attentive and took good care of us!   THE DEN: Antonio is our new BFF! Chamuko super ambiente y divertido! La verdad, con los 3 bartenders disfrutamos. The hand crafted cocktails at this bar are over the top! Everything that Antonio and Ernesto made was DELICIOUS and beautiful. We wish we could stay to hang out at this bar! True hospitality!   ZENSPA: a shoutout to Miguel!"
"1689912751-52","https://www.tripadvisor.com/Hotel_Review-g150807-d642781-Reviews-or80-Hyatt_Zilara_Cancun-Cancun_Yucatan_Peninsula.html","10","https://www.tripadvisor.com/Hotel_Review-g150807-d642781-Reviews-or90-Hyatt_Zilara_Cancun-Cancun_Yucatan_Peninsula.html","Room and service was good.  Glad to have daily activities.  Getting a taxi to coco bongo was easy.  Pool was great, along with the volleyball and exercise.  Was cool to see turtles come up on shore at night."
"1689912751-53","https://www.tripadvisor.com/Hotel_Review-g150807-d642781-Reviews-or80-Hyatt_Zilara_Cancun-Cancun_Yucatan_Peninsula.html","10","https://www.tripadvisor.com/Hotel_Review-g150807-d642781-Reviews-or90-Hyatt_Zilara_Cancun-Cancun_Yucatan_Peninsula.html","Went for sons wedding.  Staff was helpful  and freindly also the food was fantastic  never had a bad meal or drink at any of the resorts restaurants  or bar. Would  definitely  give this resort  a 5+ stars Would  definitely  return."
"1689912751-54","https://www.tripadvisor.com/Hotel_Review-g150807-d642781-Reviews-or80-Hyatt_Zilara_Cancun-Cancun_Yucatan_Peninsula.html","10","https://www.tripadvisor.com/Hotel_Review-g150807-d642781-Reviews-or90-Hyatt_Zilara_Cancun-Cancun_Yucatan_Peninsula.html","Awesome looking resort on the best beaches in Cancun. Employees are wonderful, food is great, Suites are very nice with balconies over looking the beautiful aqua water. Lots of activities, pool foam parties, tequila tasting, live entertainment every night, Show cooking, Chefs plate, sports bar, karioke, to many more great things to say.  We are diamond members, and can save you money for this resort."
"1689912751-55","https://www.tripadvisor.com/Hotel_Review-g150807-d642781-Reviews-or80-Hyatt_Zilara_Cancun-Cancun_Yucatan_Peninsula.html","10","https://www.tripadvisor.com/Hotel_Review-g150807-d642781-Reviews-or90-Hyatt_Zilara_Cancun-Cancun_Yucatan_Peninsula.html","Make sure you check your confirmation for your transfer. They will change the time from what you requested and not refund you. I had to pay $45 to make my flight because they changed my pick up time for my 8am flight to a 350am pick up. That waayyyy to early to be at a empty airport 4 HOURS before flight!"
"1689912751-56","https://www.tripadvisor.com/Hotel_Review-g150807-d642781-Reviews-or80-Hyatt_Zilara_Cancun-Cancun_Yucatan_Peninsula.html","10","https://www.tripadvisor.com/Hotel_Review-g150807-d642781-Reviews-or90-Hyatt_Zilara_Cancun-Cancun_Yucatan_Peninsula.html","Most respectable staff from the time of our check-in to the ridiculous time we had to leave in the morning. Every was over and beyond our expectations. The food/drinks were phenomenal and there was no reason we needed to leave the resort. They provided everything we needed and looked for in a vacation/getaway. No stress and most of all pure relaxation!!! Thank you Hyatt Zilara Cancun for making this trip most memorable!!!!"
"1689912751-57","https://www.tripadvisor.com/Hotel_Review-g150807-d642781-Reviews-or80-Hyatt_Zilara_Cancun-Cancun_Yucatan_Peninsula.html","10","https://www.tripadvisor.com/Hotel_Review-g150807-d642781-Reviews-or90-Hyatt_Zilara_Cancun-Cancun_Yucatan_Peninsula.html","I cannot say enough wonderful things about this resort.  Our stay was magical from beginning to end,  Every worker went out of their way to ensure we were happy.  The food and drink was excellent.  We enjoyed the entertainment each evening and the activities were fun.  The 5:00 pm events at The Den were interesting especially the Mixology session.  Dinner on the beach was well worth the extra money.  And we happen to visit during the time when the sea turtles come to shore to lay their eggs so that experience was an added bonus."
"1689912751-58","https://www.tripadvisor.com/Hotel_Review-g150807-d642781-Reviews-or80-Hyatt_Zilara_Cancun-Cancun_Yucatan_Peninsula.html","10","https://www.tripadvisor.com/Hotel_Review-g150807-d642781-Reviews-or90-Hyatt_Zilara_Cancun-Cancun_Yucatan_Peninsula.html","We had an amazing stay! The staff were all very friendly, the resort is beautiful and well maintained. The rooms are spacius and clean! There is a lot of entertainment near the pool area, bingo, art, bracelet making, and best of all... the Foam Party! The food is delicious as well. I do not have anything negative to say and highly recommend this resort. The location is ideal, near downtown and markets for shopping. If you choose to leave the resort you can do so safely! Tourist are appreciated and treated very well in this area of Mexico!"
"1689912751-59","https://www.tripadvisor.com/Hotel_Review-g150807-d642781-Reviews-or80-Hyatt_Zilara_Cancun-Cancun_Yucatan_Peninsula.html","10","https://www.tripadvisor.com/Hotel_Review-g150807-d642781-Reviews-or90-Hyatt_Zilara_Cancun-Cancun_Yucatan_Peninsula.html","We enjoyed this stay and can’t wait to come back. It exceeded our expectations in presentation and customer service.  I would recommend the Hyatt Zilara to our friends and we anticipate coming back and bringing our friends."
"1689912751-60","https://www.tripadvisor.com/Hotel_Review-g150807-d642781-Reviews-or80-Hyatt_Zilara_Cancun-Cancun_Yucatan_Peninsula.html","10","https://www.tripadvisor.com/Hotel_Review-g150807-d642781-Reviews-or90-Hyatt_Zilara_Cancun-Cancun_Yucatan_Peninsula.html","Hyatt Zilara Cancún is the absolute best resort ! We have been here 9 times and they never disappoint. We have vacation all around the Caribbean and you’ll never find a place that delivers like Zilara.  We had a small inconvenience arise and managers  CARLOS R.  & ENRIQUE rushed to assist and make it right ! There are immediate thoughtfulness, and response to correct. The situation was absolutely appreciate it and the best experience I’ve ever had from management at any resort.  Pool activities coordinator NOAH was very helpful with our cabanas and needs around the pool ! Of course the best ever pool/beach servers ELOISA, LIGIA, & REYES did the most amazing job making everything great !!!!  And we cannot forget our favorite guy AVELINO the bell Caption of Zilara. He is the most"
"1689912770-61","https://www.tripadvisor.com/Hotel_Review-g150807-d642781-Reviews-or80-Hyatt_Zilara_Cancun-Cancun_Yucatan_Peninsula.html","8","https://www.tripadvisor.com/Hotel_Review-g150807-d642781-Reviews-or70-Hyatt_Zilara_Cancun-Cancun_Yucatan_Peninsula.html","We could not have picked a better place for our honeymoon. The staff was spectacular. Anything we needed was taken care of in minutes. Although all staff was incredible, a few we remember by name are Ricardo at the swim up bar and Maria-Maria. He was so quick to serve our needs. Fernando at the swim up bar made us laugh the entire time and made the best drinks. I can't remember his exact name (Alessandro maybe) the bell boy took up to our room and was extremely informative. Carlos at Spice was extremely polite. I wish we remembered more names but they were all fabulous."
"1689912770-62","https://www.tripadvisor.com/Hotel_Review-g150807-d642781-Reviews-or80-Hyatt_Zilara_Cancun-Cancun_Yucatan_Peninsula.html","8","https://www.tripadvisor.com/Hotel_Review-g150807-d642781-Reviews-or70-Hyatt_Zilara_Cancun-Cancun_Yucatan_Peninsula.html","I had a wonderful stay at Hyatt Zilara Cancun! My goal was to enjoy a relaxing week away on a beautiful beach and that is what I got! Perfect! I was immediately welcomed upon arrival and given a brief tour of the resort. My room was spacious and comfortable with a view of the ocean.  The resort is a great place to simply relax and unwind. I spent a lot of time in a cabana on the beach and swimming in the rolling ocean waves. The prime location cabanas are for rent, but there are plenty of cabanas available for everyone. If the pool is your thing, it spans the length of the resort with two sides…one for activities(aqua fitness, pool volleyball, games and the pool parties with the entertainment team), the other for just chilling out or enjoying a drink at the swim up bar.  The"
"1689912770-63","https://www.tripadvisor.com/Hotel_Review-g150807-d642781-Reviews-or80-Hyatt_Zilara_Cancun-Cancun_Yucatan_Peninsula.html","8","https://www.tripadvisor.com/Hotel_Review-g150807-d642781-Reviews-or70-Hyatt_Zilara_Cancun-Cancun_Yucatan_Peninsula.html","We had a three day stay at the Zilara, loved the place, great staff facilities and daily activities. The food was fantastic, we would love to come back again one day. Australia is a long way away but it would be a place we would come back to if in the neighbourhood."
"1689912770-64","https://www.tripadvisor.com/Hotel_Review-g150807-d642781-Reviews-or80-Hyatt_Zilara_Cancun-Cancun_Yucatan_Peninsula.html","8","https://www.tripadvisor.com/Hotel_Review-g150807-d642781-Reviews-or70-Hyatt_Zilara_Cancun-Cancun_Yucatan_Peninsula.html","We stayed in the Presidential Suite. Our concierge Ana was the absolute best! She even gave me a special gift for my birthday.  SO SWEET! We saw the shows which were fantastic. We participated on some of the activities which were fun. We reserved dinner at the Chefs Table and met wonderful people and besides the good food we had so much laughter and fun. The staff is so gracious a d friendly  We highly recommend a stay here!"
"1689912770-65","https://www.tripadvisor.com/Hotel_Review-g150807-d642781-Reviews-or80-Hyatt_Zilara_Cancun-Cancun_Yucatan_Peninsula.html","8","https://www.tripadvisor.com/Hotel_Review-g150807-d642781-Reviews-or70-Hyatt_Zilara_Cancun-Cancun_Yucatan_Peninsula.html","Definitely recommend this hotel! It was beautiful and the staff was super friendly. The rooms were also very nice and cleaned multiple times a day. There was so much to do with all the activities and pool."
"1689912770-66","https://www.tripadvisor.com/Hotel_Review-g150807-d642781-Reviews-or80-Hyatt_Zilara_Cancun-Cancun_Yucatan_Peninsula.html","8","https://www.tripadvisor.com/Hotel_Review-g150807-d642781-Reviews-or70-Hyatt_Zilara_Cancun-Cancun_Yucatan_Peninsula.html","My friend and I stayed at the Hyatt Zilara Cancun for 4 nights this June.  Our goal was to relax, enjoy good food/drinks, and spend some quality time together.  All of the restaurants had great food and wonderful options. The staff were very friendly and accommodating.  The spa was AMAZING. Could have spent all day there.  We only left the resort once for a Tulum excursion and when we did, the guards made sure to know we were leaving and checked us back in when we arrived to know we returned.  So we felt very safe overall!  Definitely would visit this resort again if we return to Cancun!"
"1689912770-67","https://www.tripadvisor.com/Hotel_Review-g150807-d642781-Reviews-or80-Hyatt_Zilara_Cancun-Cancun_Yucatan_Peninsula.html","8","https://www.tripadvisor.com/Hotel_Review-g150807-d642781-Reviews-or70-Hyatt_Zilara_Cancun-Cancun_Yucatan_Peninsula.html","The property has really nice rooms, a very big community pool (you need to get there early to cop a cabana because the sun can be brutal), plenty of fun activities, lots of restaurants so you can explore different cultures and flavors during your stay, it's all-inclusive so all of the food and drink is included, and it's only for ADULTS, so you don't have to worry about your space being invaded with kids!"
