web-scraper-order,web-scraper-start-url,pages,pages-href,reviews
"1689912864-103","https://www.tripadvisor.com/Hotel_Review-g150807-d642781-Reviews-Hyatt_Zilara_Cancun-Cancun_Yucatan_Peninsula.html","4","https://www.tripadvisor.com/Hotel_Review-g150807-d642781-Reviews-or30-Hyatt_Zilara_Cancun-Cancun_Yucatan_Peninsula.html","This was our second time in two years to go and we absolutely had an amazing time! We went during the 4th of July and the party was incredible! I would highly recommend this place! Staff, food, rooms, scenery were wonderful!"
"1689912864-104","https://www.tripadvisor.com/Hotel_Review-g150807-d642781-Reviews-Hyatt_Zilara_Cancun-Cancun_Yucatan_Peninsula.html","4","https://www.tripadvisor.com/Hotel_Review-g150807-d642781-Reviews-or30-Hyatt_Zilara_Cancun-Cancun_Yucatan_Peninsula.html","Awesome staff and services. My wife and I return yearly to celebrate our anniversary. The staff is always amazing and are willing to do whatever it takes to make you happy. Just to name a few staff: Eddie at checking to Felipe our house keeping room attendant to waiters like Sergio, David, Jorge, Arturo, Abel, and many others the staff could not have been more helpful. We will return again and again."
"1689912864-105","https://www.tripadvisor.com/Hotel_Review-g150807-d642781-Reviews-Hyatt_Zilara_Cancun-Cancun_Yucatan_Peninsula.html","4","https://www.tripadvisor.com/Hotel_Review-g150807-d642781-Reviews-or30-Hyatt_Zilara_Cancun-Cancun_Yucatan_Peninsula.html","Stayed for 5 days with some old college friends.  Hotel was quite nice.  The staff was incredibly friendly and helpful.  Food was good.  Ate at several specialty restaurants (Asian, Mexican, Mediterranean) and they all were great.  Beach was beautiful and access to chairs and cabanas was easy.  Probably the best part of the trip was my deep tissue massage.  My therapist (Lucero) was AMAZING!  So nice.  So good!!  Not to mention the hydro therapy facility, which was SO relaxing.    Only thing I'd say is that the hotel is not brand new.  It's in great shape, but rooms are a little dated.  Not a big deal, but if you are looking for an ultra-modern hotel, there are probably others that are newer.  With that said, I doubt there will be many where the staff, food and facilities are as"
"1689912864-106","https://www.tripadvisor.com/Hotel_Review-g150807-d642781-Reviews-Hyatt_Zilara_Cancun-Cancun_Yucatan_Peninsula.html","4","https://www.tripadvisor.com/Hotel_Review-g150807-d642781-Reviews-or30-Hyatt_Zilara_Cancun-Cancun_Yucatan_Peninsula.html","Great service & resort. From the pool to the beach, everything was great. Every staff member was so professional & willing to help us out with whatever we needed. The food & drink selection was amazing."
"1689912864-107","https://www.tripadvisor.com/Hotel_Review-g150807-d642781-Reviews-Hyatt_Zilara_Cancun-Cancun_Yucatan_Peninsula.html","4","https://www.tripadvisor.com/Hotel_Review-g150807-d642781-Reviews-or30-Hyatt_Zilara_Cancun-Cancun_Yucatan_Peninsula.html","We had never been to an all-inclusive resort prior to this.  We were amazed at the level of service we received.  All the employees at this resort are top notch!!!  Cant be any happier with our experience!  We will definitely be back!  Janett and Carlos were amazing at the pool.  The Mexican Restaurant was excellent!"
"1689912864-108","https://www.tripadvisor.com/Hotel_Review-g150807-d642781-Reviews-Hyatt_Zilara_Cancun-Cancun_Yucatan_Peninsula.html","4","https://www.tripadvisor.com/Hotel_Review-g150807-d642781-Reviews-or30-Hyatt_Zilara_Cancun-Cancun_Yucatan_Peninsula.html","This hotel exceeded our expectations. The service was top notch. My hubby and I frequently visit luxury all inclusive resorts and this one blows the competition away. The staff was very attentive. I think someone came around the pool every ten minutes asking if we needed anything. Then when we rented a cabana and declined bottle service, they offered to substitute it with a tomahawk steak show or seafood platter with the works."
"1689912864-109","https://www.tripadvisor.com/Hotel_Review-g150807-d642781-Reviews-Hyatt_Zilara_Cancun-Cancun_Yucatan_Peninsula.html","4","https://www.tripadvisor.com/Hotel_Review-g150807-d642781-Reviews-or30-Hyatt_Zilara_Cancun-Cancun_Yucatan_Peninsula.html","I spent three nights at the resort and they were fantastic! Beautiful, clean, service was always great, food is amazing and there is a lot to do! Punta Vista is a great place to eat breakfast and lunch with an amazing view! Ask for Alfredo - really friendly, great service and always a smile - he took great care of us."
"1689912864-110","https://www.tripadvisor.com/Hotel_Review-g150807-d642781-Reviews-Hyatt_Zilara_Cancun-Cancun_Yucatan_Peninsula.html","4","https://www.tripadvisor.com/Hotel_Review-g150807-d642781-Reviews-or30-Hyatt_Zilara_Cancun-Cancun_Yucatan_Peninsula.html","Everyone was attentive to our needs from the moment we walked in! They accommodated my food allergies as we thoroughly enjoyed trying every restaurant on the property. We also enjoyed 3 different bars and received beverage service in the pools and at the beach. The covered areas by the beach are extremely comfortable and well maintained. Also, our room was cleaned twice per day, and we never needed to ask for dry towels. Oh, and don’t forget the spa! It was perfect midweek.   Our visit was a wonderful experience all the way around! We will be back!!"
"1689912882-111","https://www.tripadvisor.com/Hotel_Review-g150807-d642781-Reviews-Hyatt_Zilara_Cancun-Cancun_Yucatan_Peninsula.html","3","https://www.tripadvisor.com/Hotel_Review-g150807-d642781-Reviews-or20-Hyatt_Zilara_Cancun-Cancun_Yucatan_Peninsula.html","We travelled to Cancun for my girlfriends birthday and were extremely pleased with our stay at Hyatt Zilara. We came in with pretty high expectations considering all the good reviews and things we researched about the resort. They exceeded pretty much every last one of our expectations. Will definitely be back and will tell any and everyone I know to stay here when travelling to Cancun."
"1689912882-112","https://www.tripadvisor.com/Hotel_Review-g150807-d642781-Reviews-Hyatt_Zilara_Cancun-Cancun_Yucatan_Peninsula.html","3","https://www.tripadvisor.com/Hotel_Review-g150807-d642781-Reviews-or20-Hyatt_Zilara_Cancun-Cancun_Yucatan_Peninsula.html","The staff, room, restaurant, concierge servis, overall hotel and atmosphere is an excellent. We really liked the fantastic staff at the restaurant Punta Vista / Alfredo, Marco, Rodolfo, Hugo /, Spice / Samantha / and mexicans Mária Márie, where we went most often, but also all the other restaurants and bars were of very high quality"
"1689912882-113","https://www.tripadvisor.com/Hotel_Review-g150807-d642781-Reviews-Hyatt_Zilara_Cancun-Cancun_Yucatan_Peninsula.html","3","https://www.tripadvisor.com/Hotel_Review-g150807-d642781-Reviews-or20-Hyatt_Zilara_Cancun-Cancun_Yucatan_Peninsula.html","the spa is beautiful.  Clean and welcoming.  The staff is Pleasant and nice.   Got a massage from LUCEVO   She Was amazing! Felt great.   Will do it again definitely   Looking forward to my next time."
"1689912882-114","https://www.tripadvisor.com/Hotel_Review-g150807-d642781-Reviews-Hyatt_Zilara_Cancun-Cancun_Yucatan_Peninsula.html","3","https://www.tripadvisor.com/Hotel_Review-g150807-d642781-Reviews-or20-Hyatt_Zilara_Cancun-Cancun_Yucatan_Peninsula.html","Highly recommend Hyatt  Zilara! This was our first visit to the resort. It was referred to us by a family member. It truly exceeded our expectations! We recived great service. The entire staff was very friendly and helpful.  Thank you Hyatt Zilara for an amazing vacation!!!"
"1689912882-115","https://www.tripadvisor.com/Hotel_Review-g150807-d642781-Reviews-Hyatt_Zilara_Cancun-Cancun_Yucatan_Peninsula.html","3","https://www.tripadvisor.com/Hotel_Review-g150807-d642781-Reviews-or20-Hyatt_Zilara_Cancun-Cancun_Yucatan_Peninsula.html","I went on a trip with a travel group that caters to women of color and had a blast. There was plenty to do if you wanted something to do and plenty of areas to do nothing but chill. The rooms were beautiful and clean"
"1689912882-116","https://www.tripadvisor.com/Hotel_Review-g150807-d642781-Reviews-Hyatt_Zilara_Cancun-Cancun_Yucatan_Peninsula.html","3","https://www.tripadvisor.com/Hotel_Review-g150807-d642781-Reviews-or20-Hyatt_Zilara_Cancun-Cancun_Yucatan_Peninsula.html","This was our first time in Cancun and it was such a great vacation!!   The rooms were very clean and room service was available every day. The staff always had a smile on their face and was welcoming us with drinks/helping hands/etc. We were able to get cold water every day to our room/throughout the hotel. I saw a lot of people online say that Cancún has a lot of seaweed on the beach at this time, but Hyatt Zilara was super good at keeping the seaweed at a minimum on their property.  I would say that although I wish there were more choices for restaurants (especially being there were only 2 choices for lunch), the food was actually super tasty! The seafood tasted amazing! And the staff was 5/5, the best!!   Honorable mention: David in Spice Buffet was the best server!! He was"
"1689912882-117","https://www.tripadvisor.com/Hotel_Review-g150807-d642781-Reviews-Hyatt_Zilara_Cancun-Cancun_Yucatan_Peninsula.html","3","https://www.tripadvisor.com/Hotel_Review-g150807-d642781-Reviews-or20-Hyatt_Zilara_Cancun-Cancun_Yucatan_Peninsula.html","My spouse and I went for a short get-away. The hotel was beautiful, the food was excellent, the room was quiet and relaxing. Staff was extremely friendly and helpful.  This is a luxury hotel so they are strict on dress codes, keep that in mind when going to the various restaurants. They have a website with all the information available which was extremely helpful.  The evening entertainment was very fun, but on a smaller scale I think because the hotel is smaller.  The beach is magnificent here.  I highly recommend this hotel if you're looking for a luxurious and relaxing all-inclusive experience.  Please don't forget to tip the staff!!"
"1689912882-118","https://www.tripadvisor.com/Hotel_Review-g150807-d642781-Reviews-Hyatt_Zilara_Cancun-Cancun_Yucatan_Peninsula.html","3","https://www.tripadvisor.com/Hotel_Review-g150807-d642781-Reviews-or20-Hyatt_Zilara_Cancun-Cancun_Yucatan_Peninsula.html","The spa was wonderful, Miguel at the spa did a Hydotherapy and he was lovely. The activities on property are lacking. Other than one ""pool party"" day, the pools are very quiet. The only late night bar on property stops all music at 11:30pm, even though they stay open until 1:30. Most of the restaurants don't have music playing, its overall just quiet. If that is the vibe you are looking for, then great. For us, we were looking for some fun spirited activities throughout the day and evening without having to wander into downtown."
"1689912882-119","https://www.tripadvisor.com/Hotel_Review-g150807-d642781-Reviews-Hyatt_Zilara_Cancun-Cancun_Yucatan_Peninsula.html","3","https://www.tripadvisor.com/Hotel_Review-g150807-d642781-Reviews-or20-Hyatt_Zilara_Cancun-Cancun_Yucatan_Peninsula.html","Writing this review at the Cancun airport on the way back home so everything is fresh on my mind.  Hyatt Zilara Cancun is nothing but a 5 star all-inclusive resort in my experience.  Multiple options for yummy food as well as activities provided each day and night.  All the staff have been welcoming and accommodating to everyone in my group and always ready to help anyway they can. Special shout-out to our favorite bartender Jeronimo who recommend us drinks and prepared a special drink for us, Diana who was our amazing instructor for yoga and pilates class, Enrique at the cafe who remembered us each time and made our favorite caramel frappes, and David (our server at Spice) and Cesar (our server at Punta Vista) who joked around with us and we’re always so attentive during our"
"1689912882-120","https://www.tripadvisor.com/Hotel_Review-g150807-d642781-Reviews-Hyatt_Zilara_Cancun-Cancun_Yucatan_Peninsula.html","3","https://www.tripadvisor.com/Hotel_Review-g150807-d642781-Reviews-or20-Hyatt_Zilara_Cancun-Cancun_Yucatan_Peninsula.html","My experience was just outstanding. All of the staff from the front (Angel) to the server (Arturo) was just on their A Game. The overall service and food was just spectacular. You will love, love, love it."
"1689912901-121","https://www.tripadvisor.com/Hotel_Review-g150807-d642781-Reviews-Hyatt_Zilara_Cancun-Cancun_Yucatan_Peninsula.html","2","https://www.tripadvisor.com/Hotel_Review-g150807-d642781-Reviews-or10-Hyatt_Zilara_Cancun-Cancun_Yucatan_Peninsula.html","The staff at every level makes you feel welcome and appreciated.  They look to anticipate your needs and deliver time and time again.  Everyone is always smiling, enjoying what they do and they make it contagious!  You can tell it’s more than a “job” - it’s their passion!"
"1689912901-122","https://www.tripadvisor.com/Hotel_Review-g150807-d642781-Reviews-Hyatt_Zilara_Cancun-Cancun_Yucatan_Peninsula.html","2","https://www.tripadvisor.com/Hotel_Review-g150807-d642781-Reviews-or10-Hyatt_Zilara_Cancun-Cancun_Yucatan_Peninsula.html","WOW!! This resort has it all! The amazing staff, service, food, drinks and most amazing beach views! ( no seaweed!!) I have been to Mexico over 10 times and this by far was the most memorable! from check in to check out waiting or our transportation the hotel staff were offering above and beyond their services! This has got to be the most cleanest hotel I have been to in Mexico! Staff were constantly cleaning and organizing. I felt pampered and well taken care of, the pool staff were very efficient with drinks, food and making sure we were ok. At night we would watch the sea turtles come up and lay their eggs! We didn't notice any bugs! The buffet ""spices"" was our favourite place to eat! everything was so fresh and healthy! and never repetitive! And if there was something  I was"
"1689912901-123","https://www.tripadvisor.com/Hotel_Review-g150807-d642781-Reviews-Hyatt_Zilara_Cancun-Cancun_Yucatan_Peninsula.html","2","https://www.tripadvisor.com/Hotel_Review-g150807-d642781-Reviews-or10-Hyatt_Zilara_Cancun-Cancun_Yucatan_Peninsula.html","Ok resort but some of the staff was not very friendly and we did not feel that extra effort was made to make it a ""friendly"" process (at check in and check out).  We did not ask for anything above and beyond the normal accommodation but a little bit of extra effort to help a guest at check in and check out would have done wonders and would go a long way."
"1689912901-124","https://www.tripadvisor.com/Hotel_Review-g150807-d642781-Reviews-Hyatt_Zilara_Cancun-Cancun_Yucatan_Peninsula.html","2","https://www.tripadvisor.com/Hotel_Review-g150807-d642781-Reviews-or10-Hyatt_Zilara_Cancun-Cancun_Yucatan_Peninsula.html","We came here for our honeymoon on 7/10/23. We were treated like royalty from the very beginning. The food was too notch and the booze was not waterdowned. We had nothing but good things to say about the staff and cleanliness of the resort."
"1689912901-125","https://www.tripadvisor.com/Hotel_Review-g150807-d642781-Reviews-Hyatt_Zilara_Cancun-Cancun_Yucatan_Peninsula.html","2","https://www.tripadvisor.com/Hotel_Review-g150807-d642781-Reviews-or10-Hyatt_Zilara_Cancun-Cancun_Yucatan_Peninsula.html","Great trip… the hotel took excellent care.of us from Saul who checked us in to David John who carried our bags to our car when we left. Highly recommend the hydrotherapy at Zen spa  and Brenda and Elizabeth for massage services. Our cabana hosts Reyes and Humberto took great care of our crew. Thanks for a great stay!"
"1689912901-126","https://www.tripadvisor.com/Hotel_Review-g150807-d642781-Reviews-Hyatt_Zilara_Cancun-Cancun_Yucatan_Peninsula.html","2","https://www.tripadvisor.com/Hotel_Review-g150807-d642781-Reviews-or10-Hyatt_Zilara_Cancun-Cancun_Yucatan_Peninsula.html","We expected the stay to be nice.  The experience was far better than expected. Typically we go to Jamaica, but future plans will be to return to the Zilara.  Beautiful beaches, great food and wonderful staff made the experience more than we expected."
"1689912901-127","https://www.tripadvisor.com/Hotel_Review-g150807-d642781-Reviews-Hyatt_Zilara_Cancun-Cancun_Yucatan_Peninsula.html","2","https://www.tripadvisor.com/Hotel_Review-g150807-d642781-Reviews-or10-Hyatt_Zilara_Cancun-Cancun_Yucatan_Peninsula.html","My husband and I have been to Cancun many times. We decided to try Hyatt Zilara for a first time all inclusive experience. When we arrived, we realized the hotel is an open concept with no AC. The rooms open to the outside and everywhere you walk is open to the heat. They walked us to the very end of the resort for our room that was multi level after we informed them my husband can’t do stairs. Then they took us to a different room that was not very cool. The AC was as low as it would go. The ceiling fan was WONDERFUL. After we tried the lunch buffet, we decided this resort was not for us. The manger worked with us to cancel our reservation so we could go back to our original “home” in Cancun. We are from Texas and deal with the heat daily. But to not feel like we had a place to"
"1689912901-128","https://www.tripadvisor.com/Hotel_Review-g150807-d642781-Reviews-Hyatt_Zilara_Cancun-Cancun_Yucatan_Peninsula.html","2","https://www.tripadvisor.com/Hotel_Review-g150807-d642781-Reviews-or10-Hyatt_Zilara_Cancun-Cancun_Yucatan_Peninsula.html","This resort exceeded all expectations. We had a small destination wedding there. The concierge kept in contact from prior to our arrival and after checkout. We booked the swim up suite. I really liked the text messages each morning off all resort events"
"1689912901-129","https://www.tripadvisor.com/Hotel_Review-g150807-d642781-Reviews-Hyatt_Zilara_Cancun-Cancun_Yucatan_Peninsula.html","2","https://www.tripadvisor.com/Hotel_Review-g150807-d642781-Reviews-or10-Hyatt_Zilara_Cancun-Cancun_Yucatan_Peninsula.html","The oceanfront view room was exceptional, I had a single king. The hotel staff was very accommodating.  The housekeeping staff and turn down service was great.  I thought the magic box was a genius idea because the guest did not have to worry about being dressed or available when room service arrived.  There were plenty of complementary cabanas on the property and again the staff was excellent at the pool and throughout the resort.  I came with a group of women as part of a travel group (Ladies & Luggage), the combination of the excellent experience put on by the L & L travel group and the accommodating service by the hotel staff make for a magical vacation experience.  I plan to visit again sometime and bring my husband who will love it."
"1689912901-130","https://www.tripadvisor.com/Hotel_Review-g150807-d642781-Reviews-Hyatt_Zilara_Cancun-Cancun_Yucatan_Peninsula.html","2","https://www.tripadvisor.com/Hotel_Review-g150807-d642781-Reviews-or10-Hyatt_Zilara_Cancun-Cancun_Yucatan_Peninsula.html","Had the best time at Hyatt Zilara Cancun with family and friends! There’s always something going on and they have amazing food and drinks. It is conveniently located near Aquaworld, which is only a short bus ride away, where we’ve done all our excursions outside of the resort. The beach is very clean and we got the chance to see sea turtles during our stay! One of the biggest perks, personally, are the cabanas by the beach. Service is wonderful and staff is very friendly and attentive. 10/10 experience and would absolutely recommend others to visit! :)"
