web-scraper-order,web-scraper-start-url,pages,pages-href,reviews
"1689934969-71","https://www.tripadvisor.com/Hotel_Review-g23240074-d296667-Reviews-or80-La_Zebra_Colibri_Boutique_Hotel-Tulum_Beach_Tulum_Yucatan_Peninsula.html#REVIEWS","8","https://www.tripadvisor.com/Hotel_Review-g23240074-d296667-Reviews-or70-La_Zebra_Colibri_Boutique_Hotel-Tulum_Beach_Tulum_Yucatan_Peninsula.html","We came here for the day and rented a beach bed. It was a great spot food was good and serviced was amazing! Manager Will and his team really took great care of us. This is a chill spot to relax for the day!"
"1689934969-72","https://www.tripadvisor.com/Hotel_Review-g23240074-d296667-Reviews-or80-La_Zebra_Colibri_Boutique_Hotel-Tulum_Beach_Tulum_Yucatan_Peninsula.html#REVIEWS","8","https://www.tripadvisor.com/Hotel_Review-g23240074-d296667-Reviews-or70-La_Zebra_Colibri_Boutique_Hotel-Tulum_Beach_Tulum_Yucatan_Peninsula.html","We stayed at La Zebra for our honeymoon and had a lovely experience! We're very grateful to the concierges Juan Carlos, Isaías, Ricardo and Joss, along with the rest of the hotel staff, for their excellent service, help arranging tours, and recommendations for restaurants and outings. Our room was so comfortable, and the hotel has a great location right in the middle of Tulum Beach. Truly an unforgettable trip!"
"1689934990-73","https://www.tripadvisor.com/Hotel_Review-g23240074-d296667-Reviews-or80-La_Zebra_Colibri_Boutique_Hotel-Tulum_Beach_Tulum_Yucatan_Peninsula.html#REVIEWS","7","https://www.tripadvisor.com/Hotel_Review-g23240074-d296667-Reviews-or60-La_Zebra_Colibri_Boutique_Hotel-Tulum_Beach_Tulum_Yucatan_Peninsula.html","amazing atmospheric hotel and very nice and caring staff, especially the manager Ricardo. He was always helpful and very attentive. I also want to note the work of Joss at the reception, he was pleasant and smiling and always cheered me up. I saw a lot of reviews about the hotel, but I highly recommend this hotel to visit, the rest exceeded all my expectations"
"1689934990-74","https://www.tripadvisor.com/Hotel_Review-g23240074-d296667-Reviews-or80-La_Zebra_Colibri_Boutique_Hotel-Tulum_Beach_Tulum_Yucatan_Peninsula.html#REVIEWS","7","https://www.tripadvisor.com/Hotel_Review-g23240074-d296667-Reviews-or60-La_Zebra_Colibri_Boutique_Hotel-Tulum_Beach_Tulum_Yucatan_Peninsula.html","Everything about the stay was great. Staff was helpful and friendly throughout the stay. Really didn’t even need to leave the facility for anything! Would recommend to anyone. Thought and effort was accounted for whether it was the complimentary tea or attentiveness from all of the staff"
"1689934990-75","https://www.tripadvisor.com/Hotel_Review-g23240074-d296667-Reviews-or80-La_Zebra_Colibri_Boutique_Hotel-Tulum_Beach_Tulum_Yucatan_Peninsula.html#REVIEWS","7","https://www.tripadvisor.com/Hotel_Review-g23240074-d296667-Reviews-or60-La_Zebra_Colibri_Boutique_Hotel-Tulum_Beach_Tulum_Yucatan_Peninsula.html","We came for breakfast and the food was amazing. Jorge was our server and was awesome! We ended up moving to the lounge couches and hanging out for a few more drinks. Abraham took care of us and was very attentive, they surprised both of my friends for their birthdays and gave them a dessert and sang happy birthday. We will definitely be coming back here. 10/10 service and food!"
"1689934990-76","https://www.tripadvisor.com/Hotel_Review-g23240074-d296667-Reviews-or80-La_Zebra_Colibri_Boutique_Hotel-Tulum_Beach_Tulum_Yucatan_Peninsula.html#REVIEWS","7","https://www.tripadvisor.com/Hotel_Review-g23240074-d296667-Reviews-or60-La_Zebra_Colibri_Boutique_Hotel-Tulum_Beach_Tulum_Yucatan_Peninsula.html","This is hands down one of the best boutique hotels we have ever stayed in. Everything about our stay was wonderful. The hotel grounds are beautifully designed and the atmosphere is very relaxed. The beach is beautiful and the staff was relentlessly raking seaweed. Big thanks to Francisco from Reception who accommodated our wish to change rooms. Reception also organised babysitter services for us - super easy und straightforward. Rooms are beautifully furnished, housekeeping was exceptional, they also gave us softer pillows on request. The food was scrumptious and the service excellent. Special mention goes to waiters Marco and Isac who were super friendly, attentive and always up for some banter.  We have nothing negative to remark. If you are planning a trip to Tulum and it’s"
"1689935039-77","https://www.tripadvisor.com/Hotel_Review-g23240074-d296667-Reviews-La_Zebra_Colibri_Boutique_Hotel-Tulum_Beach_Tulum_Yucatan_Peninsula.html","6","https://www.tripadvisor.com/Hotel_Review-g23240074-d296667-Reviews-or50-La_Zebra_Colibri_Boutique_Hotel-Tulum_Beach_Tulum_Yucatan_Peninsula.html","German at the restaurant was so polite and so attentive. He made us feel at home and gave us great tips on sites to see. Also, he recommended that watermelon drink which will be my new obsession. Big fan of his."
"1689935039-78","https://www.tripadvisor.com/Hotel_Review-g23240074-d296667-Reviews-La_Zebra_Colibri_Boutique_Hotel-Tulum_Beach_Tulum_Yucatan_Peninsula.html","6","https://www.tripadvisor.com/Hotel_Review-g23240074-d296667-Reviews-or50-La_Zebra_Colibri_Boutique_Hotel-Tulum_Beach_Tulum_Yucatan_Peninsula.html","Awesome little hotel with super friendly staff, great food and a lovely beach. We were here in May, so there’s quite a bit of sea weed on the beach which is however removed by the staff everyday. I definitely recommend this place!"
"1689935039-79","https://www.tripadvisor.com/Hotel_Review-g23240074-d296667-Reviews-La_Zebra_Colibri_Boutique_Hotel-Tulum_Beach_Tulum_Yucatan_Peninsula.html","6","https://www.tripadvisor.com/Hotel_Review-g23240074-d296667-Reviews-or50-La_Zebra_Colibri_Boutique_Hotel-Tulum_Beach_Tulum_Yucatan_Peninsula.html","Could not recommend a better hotel to experience the magic of Tulum! The hotel is on a lovely stretch of the beach close to, but not next to the ‘party’ hotels giving you plenty of opportunity to relax and enjoy! We visited in May where naturally the seaweed builds up but the hotel staff did an incredible job of clearing this as much as possible so that you can walk along the beach and swim the waters (take a walk down the beach and you will see this is far from the case at most other hotels)! The staff were so warm and welcoming and truly treated you as friends but a big big shout out to Ricardo for his daily smiles and delightful interactions, Juan Carlos for his epic food recommendations and Abraham for his wonderful service at breakfast - they really took time out of their"
"1689935039-80","https://www.tripadvisor.com/Hotel_Review-g23240074-d296667-Reviews-La_Zebra_Colibri_Boutique_Hotel-Tulum_Beach_Tulum_Yucatan_Peninsula.html","6","https://www.tripadvisor.com/Hotel_Review-g23240074-d296667-Reviews-or50-La_Zebra_Colibri_Boutique_Hotel-Tulum_Beach_Tulum_Yucatan_Peninsula.html","The hotel is located towards the end of the ""Zona Hotelera"". So, from entering Tulum it's another 20 min to get there.  When we checked in around 1:30pm, we were told the check in is at 3pm. ""But, we are lucky, the room is already prepared."". That sounded ""off"" immediately. Coming to the room it was quite warm despite the AC blowing. That was the biggest issue for our stay. Even when running all day on HIGH. It is not getting cool in the room. The plunge pool in front of our room had decent privacy but still view to the ocean. (not all plunge pools have the same degree of privacy!!!). However, when we were brought to the room the pool didn't look cleaned (lots of sand in it) the foot cleaning basin in front of the pool had the same issue. It looked like somebody just stepped out"
"1689935039-81","https://www.tripadvisor.com/Hotel_Review-g23240074-d296667-Reviews-La_Zebra_Colibri_Boutique_Hotel-Tulum_Beach_Tulum_Yucatan_Peninsula.html","6","https://www.tripadvisor.com/Hotel_Review-g23240074-d296667-Reviews-or50-La_Zebra_Colibri_Boutique_Hotel-Tulum_Beach_Tulum_Yucatan_Peninsula.html","The best hotel in this area of Tulum. They have an amazing atmosphere. They clean up the beach daily so you can walk right into the ocean. It's the most lively hotel and beach area but still quiet and peaceful. Nicest hotel I've stayed at! Every single person that works at La Zebra was a pleasure to see. Isaiah at concierge was amazing, they all were I'm just terrible at remembering names. I highly recommend this place and I'd absolutely come back if I visit Tulum again. The rooms were impeccable."
"1689935060-82","https://www.tripadvisor.com/Hotel_Review-g23240074-d296667-Reviews-La_Zebra_Colibri_Boutique_Hotel-Tulum_Beach_Tulum_Yucatan_Peninsula.html","5","https://www.tripadvisor.com/Hotel_Review-g23240074-d296667-Reviews-or40-La_Zebra_Colibri_Boutique_Hotel-Tulum_Beach_Tulum_Yucatan_Peninsula.html","Beto was absolutely wonderful by the beach everyday! Outstanding service, food, location, and hotel amenities. The staff is extremely attentive, personal, and kind. Highly recommend the hotel to anyone traveling to Tulum!"
"1689935060-83","https://www.tripadvisor.com/Hotel_Review-g23240074-d296667-Reviews-La_Zebra_Colibri_Boutique_Hotel-Tulum_Beach_Tulum_Yucatan_Peninsula.html","5","https://www.tripadvisor.com/Hotel_Review-g23240074-d296667-Reviews-or40-La_Zebra_Colibri_Boutique_Hotel-Tulum_Beach_Tulum_Yucatan_Peninsula.html","WOW! This was the best place I have ever stayed on a vacation or traveling! I know thats a big statement buts its true. The rooms were amazing, we had our own personal mini pool/tub outside of our room which was great for late night soak or morning dip. The beach beds are so comfy, the restaurant is AMAZING, the pool is refreshing and the mango margaritas are a must. This place is unique with cherubs flying overhead as decoration, and rooms that feel individual (unlike a hotel). From the chocolate and tea evening deliveries to the chili salted fruit sticks, the menu is delicious and the amenities are plentiful.   Most of all, it was the staff that made our trip so beyond any expectations. Getting to know them throughout our stay was so fun! Joss at the front desk made La Zebra"
"1689935060-84","https://www.tripadvisor.com/Hotel_Review-g23240074-d296667-Reviews-La_Zebra_Colibri_Boutique_Hotel-Tulum_Beach_Tulum_Yucatan_Peninsula.html","5","https://www.tripadvisor.com/Hotel_Review-g23240074-d296667-Reviews-or40-La_Zebra_Colibri_Boutique_Hotel-Tulum_Beach_Tulum_Yucatan_Peninsula.html","Absolutely amazing hotel and amazing people working there made the experience! Juan Carlos and Isais were brilliant, beyond helpful at the front desk, seriously answering every question, offering excellent recommendations, booking tours, ordering mango margaritas to be sent to us at the pool and so much more! Abraham who served our breakfast every day is a gem of a human being and reason enough to stay here!"
"1689935060-85","https://www.tripadvisor.com/Hotel_Review-g23240074-d296667-Reviews-La_Zebra_Colibri_Boutique_Hotel-Tulum_Beach_Tulum_Yucatan_Peninsula.html","5","https://www.tripadvisor.com/Hotel_Review-g23240074-d296667-Reviews-or40-La_Zebra_Colibri_Boutique_Hotel-Tulum_Beach_Tulum_Yucatan_Peninsula.html","My husband and I recently had the pleasure of staying at La Zebra Hotel in Tulum, and I must say, it exceeded all our expectations. From the moment we arrived, we were captivated by the hotel's incredible eco-style, spacious and stylish rooms, and the breathtaking beauty of its surrounding territory. La Zebra truly offers an authentic and fabulous experience for anyone seeking a unique getaway.  The eco-friendly design of the hotel is remarkable. It seamlessly blends with the natural environment, showcasing a harmonious fusion of sustainability and style. We felt so taken care of during our stay. Every day we got little treats like tea, chocolate, and fresh flowers in the room. The rooms at La Zebra Hotel are simply delightful. The attention to detail is remarkable and every"
"1689935060-86","https://www.tripadvisor.com/Hotel_Review-g23240074-d296667-Reviews-La_Zebra_Colibri_Boutique_Hotel-Tulum_Beach_Tulum_Yucatan_Peninsula.html","5","https://www.tripadvisor.com/Hotel_Review-g23240074-d296667-Reviews-or40-La_Zebra_Colibri_Boutique_Hotel-Tulum_Beach_Tulum_Yucatan_Peninsula.html","La Zebra was an incredible place to stay! From the moment you arrive, you’re well taken care of - a cocktail and seaside cabana greeted us immediately to entertain us while we waited for our room to be ready.   Our room itself was incredible, with an ocean view, private plunge pool, and massive double shower.   The little bits of hospitality the staff is constantly giving guests make you feel like a king/queen. Tea and chocolate waiting for you in your room when you return. The staff is eager to give recommendations and help in any way they can. When our shuttle back to the airport bailed on us last minute, the staff helped us stay calm and secure a taxi to arrive just in the nick of time. Francisco and Joss were two specific employees who were outstanding, but we had great"
"1689935060-87","https://www.tripadvisor.com/Hotel_Review-g23240074-d296667-Reviews-La_Zebra_Colibri_Boutique_Hotel-Tulum_Beach_Tulum_Yucatan_Peninsula.html","5","https://www.tripadvisor.com/Hotel_Review-g23240074-d296667-Reviews-or40-La_Zebra_Colibri_Boutique_Hotel-Tulum_Beach_Tulum_Yucatan_Peninsula.html","La Zebra is an amazing place to stay and enjoy Tulum! The beach and room service from Beto was wonderful - always fast and friendly, and he always knew what we needed! The food and drinks were amazing and so flavorful. The rooms are beautiful, overlooking the ocean, and the vibes of the whole resort are so fun and colorful, yet relaxing at the same time! The beds and beach set ups are both very comfortable, we’ve slept at least 10 hours a night since we’ve been here, plus naps! Also had a massage yesterday, which was really good for getting at my knots in my back. Thank you to Beto and everyone for the best visit!"
"1689935080-88","https://www.tripadvisor.com/Hotel_Review-g23240074-d296667-Reviews-La_Zebra_Colibri_Boutique_Hotel-Tulum_Beach_Tulum_Yucatan_Peninsula.html","4","https://www.tripadvisor.com/Hotel_Review-g23240074-d296667-Reviews-or30-La_Zebra_Colibri_Boutique_Hotel-Tulum_Beach_Tulum_Yucatan_Peninsula.html","We had an amazing time at the beach club. The staff is friendly and attentive. The food is great and the drinks are delicious.  We’ll definitely look to stay here next time we’re in Tulum. Isaac was an amazing host and we’ll definitely be back."
"1689935080-89","https://www.tripadvisor.com/Hotel_Review-g23240074-d296667-Reviews-La_Zebra_Colibri_Boutique_Hotel-Tulum_Beach_Tulum_Yucatan_Peninsula.html","4","https://www.tripadvisor.com/Hotel_Review-g23240074-d296667-Reviews-or30-La_Zebra_Colibri_Boutique_Hotel-Tulum_Beach_Tulum_Yucatan_Peninsula.html","We came to La Zebra for a weekend away. First time in Tulum. Th staff were very friendly. The rooms are clean and have stunning views of the beach. The beach area is immaculate, with staff clearing the sand of seaweed each morning before guests are awake."
"1689935080-90","https://www.tripadvisor.com/Hotel_Review-g23240074-d296667-Reviews-La_Zebra_Colibri_Boutique_Hotel-Tulum_Beach_Tulum_Yucatan_Peninsula.html","4","https://www.tripadvisor.com/Hotel_Review-g23240074-d296667-Reviews-or30-La_Zebra_Colibri_Boutique_Hotel-Tulum_Beach_Tulum_Yucatan_Peninsula.html","Beautiful rooms. Plunge pool was amazing. Great food in the restaurant with excellent service from Abraham and Jairo. Concierge was always helpful with any requests or questions about transportation or sites to see."
"1689935080-91","https://www.tripadvisor.com/Hotel_Review-g23240074-d296667-Reviews-La_Zebra_Colibri_Boutique_Hotel-Tulum_Beach_Tulum_Yucatan_Peninsula.html","4","https://www.tripadvisor.com/Hotel_Review-g23240074-d296667-Reviews-or30-La_Zebra_Colibri_Boutique_Hotel-Tulum_Beach_Tulum_Yucatan_Peninsula.html","Abraham the serve at the restaurant made my day! He is amazing ! He went above and beyond for us.   The hotel is amazing ! Very intimate. They are invested in making it their mission yo make us happy."
"1689935080-92","https://www.tripadvisor.com/Hotel_Review-g23240074-d296667-Reviews-La_Zebra_Colibri_Boutique_Hotel-Tulum_Beach_Tulum_Yucatan_Peninsula.html","4","https://www.tripadvisor.com/Hotel_Review-g23240074-d296667-Reviews-or30-La_Zebra_Colibri_Boutique_Hotel-Tulum_Beach_Tulum_Yucatan_Peninsula.html","The hotel experience was excellent. The food was exceptional. Our room was  clean and nicely put together. The beach views were nice.. Of course, there was a little bit of seaweed, but it somewhat cleared up . Overall, I’m very pleased with my experience would definitely come back again don’t hesitate to book! Abraham, Johnathan, and Jairo were very accommodating."
"1689935101-93","https://www.tripadvisor.com/Hotel_Review-g23240074-d296667-Reviews-La_Zebra_Colibri_Boutique_Hotel-Tulum_Beach_Tulum_Yucatan_Peninsula.html","3","https://www.tripadvisor.com/Hotel_Review-g23240074-d296667-Reviews-or20-La_Zebra_Colibri_Boutique_Hotel-Tulum_Beach_Tulum_Yucatan_Peninsula.html","Johnathan and Issac were incredibly attentive and super friendly guys. La Zebra is very quaint and very attentive to all your needs. This is the second time staying here. Front desk staff, Issah and Carlos also made our stay seemless and easy."
"1689935101-94","https://www.tripadvisor.com/Hotel_Review-g23240074-d296667-Reviews-La_Zebra_Colibri_Boutique_Hotel-Tulum_Beach_Tulum_Yucatan_Peninsula.html","3","https://www.tripadvisor.com/Hotel_Review-g23240074-d296667-Reviews-or20-La_Zebra_Colibri_Boutique_Hotel-Tulum_Beach_Tulum_Yucatan_Peninsula.html","La Zebra is the best boutique hotel for relaxation and the IG moments. The staff is incredible, the rooms are quaint and the FOOD is to die for.   Jonathan was our waiter the entire stay and cannot recommend him enough. He was friendly, quick service and we loved seeing a familiar face every day.   Can’t wait to come back’"
"1689935101-95","https://www.tripadvisor.com/Hotel_Review-g23240074-d296667-Reviews-La_Zebra_Colibri_Boutique_Hotel-Tulum_Beach_Tulum_Yucatan_Peninsula.html","3","https://www.tripadvisor.com/Hotel_Review-g23240074-d296667-Reviews-or20-La_Zebra_Colibri_Boutique_Hotel-Tulum_Beach_Tulum_Yucatan_Peninsula.html","Jonathan did everything he could and more to ensure my family and I had a great time. Will definitely visit again. My kid enjoyed her fish fingers and my wife the cocktails. I found the beach beds to be comfy, and the pool close by to both the beach and the restaurant was a plus."
"1689935101-96","https://www.tripadvisor.com/Hotel_Review-g23240074-d296667-Reviews-La_Zebra_Colibri_Boutique_Hotel-Tulum_Beach_Tulum_Yucatan_Peninsula.html","3","https://www.tripadvisor.com/Hotel_Review-g23240074-d296667-Reviews-or20-La_Zebra_Colibri_Boutique_Hotel-Tulum_Beach_Tulum_Yucatan_Peninsula.html","Jonathan was the best server when we visited for a day. He was amazing and very accommodating with our kids. We spent the whole day at La Zebra using the pool and the beach beds. Food was excellent. Thanks Jonathan!"
"1689935101-97","https://www.tripadvisor.com/Hotel_Review-g23240074-d296667-Reviews-La_Zebra_Colibri_Boutique_Hotel-Tulum_Beach_Tulum_Yucatan_Peninsula.html","3","https://www.tripadvisor.com/Hotel_Review-g23240074-d296667-Reviews-or20-La_Zebra_Colibri_Boutique_Hotel-Tulum_Beach_Tulum_Yucatan_Peninsula.html","Jaime, Jonathan, Santi, and all of the other staff were absolutely amazing; the food is SO GOOD!! We had a room with our own swim up pool, and all the staff were helpful and even brought our drinks and food right up to us. I feel so relaxed thank you!!"
"1689935109-98","https://www.tripadvisor.com/Hotel_Review-g23240074-d296667-Reviews-La_Zebra_Colibri_Boutique_Hotel-Tulum_Beach_Tulum_Yucatan_Peninsula.html","2","https://www.tripadvisor.com/Hotel_Review-g23240074-d296667-Reviews-or10-La_Zebra_Colibri_Boutique_Hotel-Tulum_Beach_Tulum_Yucatan_Peninsula.html","Beautiful experience , amazing location , The staff out standing  very friendly and service professional and attentive DEFINITELY WE COMING BACK !!!!  Thank you Raphael for delicious  drinks on the beach !!!  Special thanks for the whole team of housekeeping to be always with positive actitud !!  Con amore Lily"
"1689935109-99","https://www.tripadvisor.com/Hotel_Review-g23240074-d296667-Reviews-La_Zebra_Colibri_Boutique_Hotel-Tulum_Beach_Tulum_Yucatan_Peninsula.html","2","https://www.tripadvisor.com/Hotel_Review-g23240074-d296667-Reviews-or10-La_Zebra_Colibri_Boutique_Hotel-Tulum_Beach_Tulum_Yucatan_Peninsula.html","Had the best time at the zebra bar and restaurant. My  Friend and I spent all day in the front cabanas with the best service. I the early evening, we enjoyed the  Most delicious drinks at their inner bar. the manager' Will, was very inviting I'm brought energy to the place.  A definite comeback."
"1689935109-100","https://www.tripadvisor.com/Hotel_Review-g23240074-d296667-Reviews-La_Zebra_Colibri_Boutique_Hotel-Tulum_Beach_Tulum_Yucatan_Peninsula.html","2","https://www.tripadvisor.com/Hotel_Review-g23240074-d296667-Reviews-or10-La_Zebra_Colibri_Boutique_Hotel-Tulum_Beach_Tulum_Yucatan_Peninsula.html","Our stay here was amazing. The staff was very attentive. Abraham was great! Please look for him when you arrive. Highly recommend staying here. It’s family friendly and there are activities for kids."
"1689935109-101","https://www.tripadvisor.com/Hotel_Review-g23240074-d296667-Reviews-La_Zebra_Colibri_Boutique_Hotel-Tulum_Beach_Tulum_Yucatan_Peninsula.html","2","https://www.tripadvisor.com/Hotel_Review-g23240074-d296667-Reviews-or10-La_Zebra_Colibri_Boutique_Hotel-Tulum_Beach_Tulum_Yucatan_Peninsula.html","This small property is a gem more so because of its people. Carlos & Joss upfront at the reception were super friendly and helpful, the entire staff at the property is super good. The food at the restaurants in the property were consistent and very good through your our stay. The property is family friendly.   It would have been an easy 5* rating only that on our first morning the hotel ran out of water for a good 3 hours, we were jet lagged from over 2 days of air travel before reaching the property only to get up in the morning with the taps running dry.   Tip: Ask Carlos for restaurant suggestions his suggestions were spot on !"
"1689935109-102","https://www.tripadvisor.com/Hotel_Review-g23240074-d296667-Reviews-La_Zebra_Colibri_Boutique_Hotel-Tulum_Beach_Tulum_Yucatan_Peninsula.html","2","https://www.tripadvisor.com/Hotel_Review-g23240074-d296667-Reviews-or10-La_Zebra_Colibri_Boutique_Hotel-Tulum_Beach_Tulum_Yucatan_Peninsula.html","Staff was very attentive and respectful.   They really got to know the guests individually.   Really nice rooms with double rain shower and private dipping pool.  First time in Talum. Zebra was more mellow and tranquil.  A great escape in between great times with friends staying els"
"1689935109-103","https://www.tripadvisor.com/Hotel_Review-g23240074-d296667-Reviews-La_Zebra_Colibri_Boutique_Hotel-Tulum_Beach_Tulum_Yucatan_Peninsula.html","2","https://www.tripadvisor.com/Hotel_Review-g23240074-d296667-Reviews-or10-La_Zebra_Colibri_Boutique_Hotel-Tulum_Beach_Tulum_Yucatan_Peninsula.html","This is the cutest boutique resort ever.  The suites are well appointed and absolutely beautiful!  The beach is well cared for and the cabanas are a huge plus.  Although the beach is public, it feels private, especially in the evenings.  The food is great and I can’t say enough positive things about the service.  Jonathan was our server both on the beach and in the restaurant and he was very attentive, kind, and helpful.  He made our experience extra special.  We traveled with another family and our kids found the resort to be just as enjoyable as we did.  Will definitely return."
"1689935109-104","https://www.tripadvisor.com/Hotel_Review-g23240074-d296667-Reviews-La_Zebra_Colibri_Boutique_Hotel-Tulum_Beach_Tulum_Yucatan_Peninsula.html","2","https://www.tripadvisor.com/Hotel_Review-g23240074-d296667-Reviews-or10-La_Zebra_Colibri_Boutique_Hotel-Tulum_Beach_Tulum_Yucatan_Peninsula.html","Amazing!  Beautiful setting and an outstanding experience.  The staff does a wonderful job making sure your every need is met with a smile!  Delicious food and great cocktails.  Very family friendly. Truly an amazing small boutique hotel. The facilities are in tip top shape.  Our 5 night stay was perfect.  We will definitely be back!"
"1689935133-105","https://www.tripadvisor.com/Hotel_Review-g150813-d291564-Reviews-or80-Ahau_Tulum_By_Ahau_Collection-Tulum_Yucatan_Peninsula.html#REVIEWS","11","https://www.tripadvisor.com/Hotel_Review-g150813-d291564-Reviews-or100-Ahau_Tulum_By_Ahau_Collection-Tulum_Yucatan_Peninsula.html","Had a wonderful time at Ahau. It's a wonderful establishment that is small and boutique. Staff is like family. Everything taken care off, beautiful premises and great food. Thanks! We'll certainly go back next year for another run."
"1689935133-106","https://www.tripadvisor.com/Hotel_Review-g150813-d291564-Reviews-or80-Ahau_Tulum_By_Ahau_Collection-Tulum_Yucatan_Peninsula.html#REVIEWS","11","https://www.tripadvisor.com/Hotel_Review-g150813-d291564-Reviews-or100-Ahau_Tulum_By_Ahau_Collection-Tulum_Yucatan_Peninsula.html","What an amazing experience! We had so much fun and were blown away by all of the staff! Tanet at the front desk was absolutely amazing, she was always there to help! Berna at the lobby bar and restaurant was so very friendly and made out experience that much more! We also did a romantic dinner on the beach which was perfect! Our waiters Jonny and Carlos were the best ever! We are booking again today too come back and stay!"
