web-scraper-order,web-scraper-start-url,pages,pages-href,reviews
"1689935281-145","https://www.tripadvisor.com/Hotel_Review-g150813-d291564-Reviews-Ahau_Tulum_By_Ahau_Collection-Tulum_Yucatan_Peninsula.html","3","https://www.tripadvisor.com/Hotel_Review-g150813-d291564-Reviews-or20-Ahau_Tulum_By_Ahau_Collection-Tulum_Yucatan_Peninsula.html","We came for a beach day here. Very chill place, good music and good service. Facility has pool, beach bar, showers etc. Also, they have famous art pieces. Ricky made our day, he was very helpful, friendly and everything was on time.  Highly recommend!"
"1689935281-146","https://www.tripadvisor.com/Hotel_Review-g150813-d291564-Reviews-Ahau_Tulum_By_Ahau_Collection-Tulum_Yucatan_Peninsula.html","3","https://www.tripadvisor.com/Hotel_Review-g150813-d291564-Reviews-or20-Ahau_Tulum_By_Ahau_Collection-Tulum_Yucatan_Peninsula.html","We spent the day at the beach club. Jesus our server was fantastic. Food was amazing. I ordered a arrachera. The drinks were also amazing. The place is a little expensive but it’s worth it. Next time we will stay at this hotel!"
"1689935281-147","https://www.tripadvisor.com/Hotel_Review-g150813-d291564-Reviews-Ahau_Tulum_By_Ahau_Collection-Tulum_Yucatan_Peninsula.html","3","https://www.tripadvisor.com/Hotel_Review-g150813-d291564-Reviews-or20-Ahau_Tulum_By_Ahau_Collection-Tulum_Yucatan_Peninsula.html","BEST SERVICE we loved all of the staff at Ahau. They were extremely helpful and friendly, especially servers Sergio and Jesus at the beautiful restaurant/bar with a beachfront view. Our room was cleaned every day and coffee was delivered in the morning at 8:30am, it was amazing. Beachfront is the best way to go when booking your room, but wherever you are it’s great jungle vibes. Raw cafe is also delicious at the hotel. Highly recommend, we miss it already."
"1689935281-148","https://www.tripadvisor.com/Hotel_Review-g150813-d291564-Reviews-Ahau_Tulum_By_Ahau_Collection-Tulum_Yucatan_Peninsula.html","3","https://www.tripadvisor.com/Hotel_Review-g150813-d291564-Reviews-or20-Ahau_Tulum_By_Ahau_Collection-Tulum_Yucatan_Peninsula.html","Great service and attention by Waiter Armando, the view and the food was great, which means the time and money was well spent. We are looking forward to coming back sometime soon. Thank you for the service!"
"1689935300-149","https://www.tripadvisor.com/Hotel_Review-g150813-d291564-Reviews-Ahau_Tulum_By_Ahau_Collection-Tulum_Yucatan_Peninsula.html","2","https://www.tripadvisor.com/Hotel_Review-g150813-d291564-Reviews-or10-Ahau_Tulum_By_Ahau_Collection-Tulum_Yucatan_Peninsula.html","We had been to Tulum like, 16 years ago.  Little did we know how much it had changed.   We arrived pretty late (midnight) but the security guard hoisted our 3 full size bags and carried them over the sand and up to the second floor!  We found out that one of the pieces of furniture was moldy and smelled pretty bad, and my wife was very sensitive to it.  First thing in the morning we called the manager (Muntse) (sp?) and she came in with like, 8 guys and took it out, brought in a dehumidifier and everything was very pleasant after that.  A little later that day, we were at the beach and were surprised by a bottle of Sauvignion Blanc, which we enjoyed and which made the whole day better (of course)!  The room looked over the ocean and was always clean.  The food and the service"
"1689935300-150","https://www.tripadvisor.com/Hotel_Review-g150813-d291564-Reviews-Ahau_Tulum_By_Ahau_Collection-Tulum_Yucatan_Peninsula.html","2","https://www.tripadvisor.com/Hotel_Review-g150813-d291564-Reviews-or10-Ahau_Tulum_By_Ahau_Collection-Tulum_Yucatan_Peninsula.html","All of the staff is great, loved the young front desk woman and the chef makes AMAZING food! Sergio is great and friendly! He remembered my name, helped me with my order and with my Spanish. Thanks for making my time here special!"
"1689935300-151","https://www.tripadvisor.com/Hotel_Review-g150813-d291564-Reviews-Ahau_Tulum_By_Ahau_Collection-Tulum_Yucatan_Peninsula.html","2","https://www.tripadvisor.com/Hotel_Review-g150813-d291564-Reviews-or10-Ahau_Tulum_By_Ahau_Collection-Tulum_Yucatan_Peninsula.html","Excellent place the staff was AMAZING. Please go visit this nice shaded area with a full view of beach it’s a must see besides the statue you’ll love it up!!! The view was amazing as well make it a stop!!!!"
"1689935300-152","https://www.tripadvisor.com/Hotel_Review-g150813-d291564-Reviews-Ahau_Tulum_By_Ahau_Collection-Tulum_Yucatan_Peninsula.html","2","https://www.tripadvisor.com/Hotel_Review-g150813-d291564-Reviews-or10-Ahau_Tulum_By_Ahau_Collection-Tulum_Yucatan_Peninsula.html","Berna was an amazing waiter, he really took good care of my friends and I and made sure we were good at all times. Will be coming back . Ask for BERNA . He will make sure you have a great time and want to come back."
"1689935340-153","https://www.tripadvisor.com/Hotel_Review-g150813-d19369566-Reviews-or80-Copal_Tulum_Hotel-Tulum_Yucatan_Peninsula.html#REVIEWS","11","https://www.tripadvisor.com/Hotel_Review-g150813-d19369566-Reviews-or100-Copal_Tulum_Hotel-Tulum_Yucatan_Peninsula.html","We had a great experience and stay. The rooms were beautiful and clean, the vibes were very Tulum and the drinks were deliciously craft just like the food. We had an issue with our room door locking and the staff accommodated us quickly and upgraded to a nicer room. Staff is very friendly and welcoming. We will be back. Thank you!!"
"1689935340-154","https://www.tripadvisor.com/Hotel_Review-g150813-d19369566-Reviews-or80-Copal_Tulum_Hotel-Tulum_Yucatan_Peninsula.html#REVIEWS","11","https://www.tripadvisor.com/Hotel_Review-g150813-d19369566-Reviews-or100-Copal_Tulum_Hotel-Tulum_Yucatan_Peninsula.html","Enjoyed my stay, service very good  Jorge and Ana really looked after us, made sure we had everything we needed  And claudio was helpful, the restaurant had the best drinks, I’ll never forget the strawberry margarita!  I’d 100% come back to the copal Tulum"
"1689935340-155","https://www.tripadvisor.com/Hotel_Review-g150813-d19369566-Reviews-or80-Copal_Tulum_Hotel-Tulum_Yucatan_Peninsula.html#REVIEWS","11","https://www.tripadvisor.com/Hotel_Review-g150813-d19369566-Reviews-or100-Copal_Tulum_Hotel-Tulum_Yucatan_Peninsula.html","The facilities were very clean and quaint.  The staff was lovely.  Enjoyed resting by pool and the yoga class.  Enjoyed the proximity between beach and town.  I would come and stay at Copal Tulum again.  Feel refreshed and relaxed and ready to go back to states."
"1689935340-156","https://www.tripadvisor.com/Hotel_Review-g150813-d19369566-Reviews-or80-Copal_Tulum_Hotel-Tulum_Yucatan_Peninsula.html#REVIEWS","11","https://www.tripadvisor.com/Hotel_Review-g150813-d19369566-Reviews-or100-Copal_Tulum_Hotel-Tulum_Yucatan_Peninsula.html","We stayed at the hotel Copal through Booking.Com., Though our room was nice enough, they provided less than we ever thought possible. No soap, occasional towels and no bathroom mats. I spent most of my day begging for the bare minimum. We were dismissed, ignored and made fun of. I felt it was hazardous and even slipped on my bathroom floor. I fell and as a 75 year old woman, it was bad. I was afraid I broke my elbow and dislocated my kneecap. Thankfully we are leaving tomorrow, I broke down crying and they finally brought ice , towels and mats but no water. Some of the staff were lovely but mostly indifferent and disorganized."
"1689935340-157","https://www.tripadvisor.com/Hotel_Review-g150813-d19369566-Reviews-or80-Copal_Tulum_Hotel-Tulum_Yucatan_Peninsula.html#REVIEWS","11","https://www.tripadvisor.com/Hotel_Review-g150813-d19369566-Reviews-or100-Copal_Tulum_Hotel-Tulum_Yucatan_Peninsula.html","It was nice, easy to get a taxi. Hotel very beautiful. Hotel staff very helpful and friendly. Many things close by like restaurants and activities. But taxi is expensive so negotiate prices.  Make sure to also pack bug spray, there are a lot of insects"
"1689935340-158","https://www.tripadvisor.com/Hotel_Review-g150813-d19369566-Reviews-or80-Copal_Tulum_Hotel-Tulum_Yucatan_Peninsula.html#REVIEWS","11","https://www.tripadvisor.com/Hotel_Review-g150813-d19369566-Reviews-or100-Copal_Tulum_Hotel-Tulum_Yucatan_Peninsula.html","Really nice accomodations. The hotel restaurants are really good too - both the Mexican place and the Sushi place. I will say that if you get the rooms with the private pool, make sure you pay attention at night because they may or may not be well lit outside!"
"1689935354-159","https://www.tripadvisor.com/Hotel_Review-g150813-d19369566-Reviews-or80-Copal_Tulum_Hotel-Tulum_Yucatan_Peninsula.html#REVIEWS","10","https://www.tripadvisor.com/Hotel_Review-g150813-d19369566-Reviews-or90-Copal_Tulum_Hotel-Tulum_Yucatan_Peninsula.html","Our stay was amazing, the hotel is so cute and has a nice layout with different room options.  Claudio and Anna were amazing help!   Erik was great help in the outdoor pool area and provided great service!"
"1689935354-160","https://www.tripadvisor.com/Hotel_Review-g150813-d19369566-Reviews-or80-Copal_Tulum_Hotel-Tulum_Yucatan_Peninsula.html#REVIEWS","10","https://www.tripadvisor.com/Hotel_Review-g150813-d19369566-Reviews-or90-Copal_Tulum_Hotel-Tulum_Yucatan_Peninsula.html","This property is BEAUTIFUL! Very friendly staff. Upon checkout, we've already reserved another night next week. Jorge, Claudio, and Jasmine are all so accommodating. I'd highly recommend staying here!"
"1689935354-161","https://www.tripadvisor.com/Hotel_Review-g150813-d19369566-Reviews-or80-Copal_Tulum_Hotel-Tulum_Yucatan_Peninsula.html#REVIEWS","10","https://www.tripadvisor.com/Hotel_Review-g150813-d19369566-Reviews-or90-Copal_Tulum_Hotel-Tulum_Yucatan_Peninsula.html","What a fabulous hotel. Everything here is relaxed and relaxing. The front desk staff are friendly and welcoming, and everyone is helpful and kind. Special shout out to Ana who helped us when we arrived and checked out. The swimming pools are clean and beautiful, the food is good and if you have the means, check out the Kokoro Japanese restaurant. Hands down the best sushi I ever had.  The only down side is the hotel is a little removed from the center and taxis are expensive (200MXP one way or 400 to the beach) but it’s a 15-min walk to the center  through the local neighborhood which is totally fine. The hotel also has bikes for rent. Hope to make it back one day!"
"1689935354-162","https://www.tripadvisor.com/Hotel_Review-g150813-d19369566-Reviews-or80-Copal_Tulum_Hotel-Tulum_Yucatan_Peninsula.html#REVIEWS","10","https://www.tripadvisor.com/Hotel_Review-g150813-d19369566-Reviews-or90-Copal_Tulum_Hotel-Tulum_Yucatan_Peninsula.html","Beautiful hotel everyone was extremely friendly and polite Ana and Johnny in particular. Food was excellent breakfast lunch and dinner. Great location close to everything. The pools were amazing also especially the roof top. Gym also really nice enough in there to get your work out done. Would 100% recommend if staying in Tulum"
"1689935354-163","https://www.tripadvisor.com/Hotel_Review-g150813-d19369566-Reviews-or80-Copal_Tulum_Hotel-Tulum_Yucatan_Peninsula.html#REVIEWS","10","https://www.tripadvisor.com/Hotel_Review-g150813-d19369566-Reviews-or90-Copal_Tulum_Hotel-Tulum_Yucatan_Peninsula.html","I stayed in this hotel after seeing some good tiktoks. The hotel has a great ambiance and vibe that you want to see when you come to Tulum but that was it. the food was good at the restaurants on site. My group of 5 stayed here for our friend's birthday and it was the worst experience and i've been to mexico several times. The room was full of mold. it had this awful moldy, wet smell that lingered into my clothes and luggage all the way home. The whole apartment was just wet, sticky,  muggy and humid. We barely had towels or washclothes, even after asking for some we were told most times that there were none and we had to wait hours sometimes to even get them. Most nights we had to wash up with our hands because they did not have towels or washclothes at all. The one time we did"
"1689935354-164","https://www.tripadvisor.com/Hotel_Review-g150813-d19369566-Reviews-or80-Copal_Tulum_Hotel-Tulum_Yucatan_Peninsula.html#REVIEWS","10","https://www.tripadvisor.com/Hotel_Review-g150813-d19369566-Reviews-or90-Copal_Tulum_Hotel-Tulum_Yucatan_Peninsula.html","Enjoy the past stay, it's an amasing ambiance with wonderful views and and incredilble staff, specially Ana, Claudio, Jorge and Jazmín who welcome us and made us feel like if we where un home. Continue like that amazing job."
"1689935373-165","https://www.tripadvisor.com/Hotel_Review-g150813-d19369566-Reviews-or80-Copal_Tulum_Hotel-Tulum_Yucatan_Peninsula.html#REVIEWS","8","https://www.tripadvisor.com/Hotel_Review-g150813-d19369566-Reviews-or70-Copal_Tulum_Hotel-Tulum_Yucatan_Peninsula.html","Thank you very much Hotel Copal Tulum! I am very grateful to the Hotel Copal for making my stay wonderful, thank you very much for always being aware of my experience, thanks to the front desk team for your kindness and guidance. Thanks to the General Manager Edgar for his hospitality and always being attentive to the needs of my stay. I will definitely return to this great hotel on my next trip to Tulum. Congratulations! 1000%."
"1689935373-166","https://www.tripadvisor.com/Hotel_Review-g150813-d19369566-Reviews-or80-Copal_Tulum_Hotel-Tulum_Yucatan_Peninsula.html#REVIEWS","8","https://www.tripadvisor.com/Hotel_Review-g150813-d19369566-Reviews-or70-Copal_Tulum_Hotel-Tulum_Yucatan_Peninsula.html","Amazing experience, dreamlike boutique hotel. You could smell Copal incense 24x7, and there were so many relaxing activities. The concierge Betty was so kind, she recommended we take a massage at “The healing spot”….  It makes you whole again."
"1689935373-167","https://www.tripadvisor.com/Hotel_Review-g150813-d19369566-Reviews-or80-Copal_Tulum_Hotel-Tulum_Yucatan_Peninsula.html#REVIEWS","8","https://www.tripadvisor.com/Hotel_Review-g150813-d19369566-Reviews-or70-Copal_Tulum_Hotel-Tulum_Yucatan_Peninsula.html","After spending a week at Copal hotel in Tulum I have mixed feelings about my stay.   food and drinks felt somewhat overpriced and I felt it was odd that the hotel asked for a tip when ordering a smoothie from the roomservice. Rooms themselves were okay, but our roomservice kept forgetting to bring in new towels, although they carried away the old ones. Facilities were generally clean but the hotel feels a bit confined. For example, the rooftop pool area was nice but had only limited space for guests. Moreover, guests would occupy these sun beds for the whole day, marking them with their towels, even if they decided to go elsewhere. Staff were nice and smiley, but one could say they were also inexperienced with tourists. We got some nice restaurant suggestions but tips on how to"
"1689935373-168","https://www.tripadvisor.com/Hotel_Review-g150813-d19369566-Reviews-or80-Copal_Tulum_Hotel-Tulum_Yucatan_Peninsula.html#REVIEWS","8","https://www.tripadvisor.com/Hotel_Review-g150813-d19369566-Reviews-or70-Copal_Tulum_Hotel-Tulum_Yucatan_Peninsula.html","I love this hotel , the people working there are amazing and very helpful, Rafael check me in and gave me the best service ! Also Ana, Jorse , johnny and  so many others there are wonderful stuff. The guys who helped us by the pool and took our staff to the rooms are amazingly helpful. The hotel is beautiful and the rooms are what Tulum has to offer at its best !"
"1689935373-169","https://www.tripadvisor.com/Hotel_Review-g150813-d19369566-Reviews-or80-Copal_Tulum_Hotel-Tulum_Yucatan_Peninsula.html#REVIEWS","8","https://www.tripadvisor.com/Hotel_Review-g150813-d19369566-Reviews-or70-Copal_Tulum_Hotel-Tulum_Yucatan_Peninsula.html","This hotel was the best decision we made for our trip to Tulum. Super lovely room and private pool, great and helpful staff. About a 15 minute walk from central Tulum and 15-20 minute drive to the ruins. Would highly recommend this hotel to anyone looking for a great deal in Tulum."
"1689935373-170","https://www.tripadvisor.com/Hotel_Review-g150813-d19369566-Reviews-or80-Copal_Tulum_Hotel-Tulum_Yucatan_Peninsula.html#REVIEWS","8","https://www.tripadvisor.com/Hotel_Review-g150813-d19369566-Reviews-or70-Copal_Tulum_Hotel-Tulum_Yucatan_Peninsula.html","Copal Tulum is a hidden gem. A sanctuary of relaxation.  Immersion in the trees, Copal cleansing at 6pm each evening, yoga, massage, meditation and a happiness agreement.  Pure joy.  There are two amazing restaurants - international and Japanese.  Both are exceptional 5 Stars.  High quality and clean food.  On arrival all staff were already aware of my food allergies of Gluten and Almonds.  Betty the customer service manager and her team were always available by what’s app with advice and guidance.  The rooftop infinity pool was sublime.  My wife cried with joy at this magical place.  We highly highly recommend it."
"1689935373-171","https://www.tripadvisor.com/Hotel_Review-g150813-d19369566-Reviews-or80-Copal_Tulum_Hotel-Tulum_Yucatan_Peninsula.html#REVIEWS","8","https://www.tripadvisor.com/Hotel_Review-g150813-d19369566-Reviews-or70-Copal_Tulum_Hotel-Tulum_Yucatan_Peninsula.html","Everyone was amazing, our server at the breakfast was really good and the guy at the bar upstairs too, also front desk Claudio, Rosalia y Jazmine were very helpful with everything. Amazing experience will definitely come back"
"1689935373-172","https://www.tripadvisor.com/Hotel_Review-g150813-d19369566-Reviews-or80-Copal_Tulum_Hotel-Tulum_Yucatan_Peninsula.html#REVIEWS","8","https://www.tripadvisor.com/Hotel_Review-g150813-d19369566-Reviews-or70-Copal_Tulum_Hotel-Tulum_Yucatan_Peninsula.html","Beautiful people , beautiful room , all the food was vey very good , beautiful roof top pool , very close to the street life. Overall my experience here was great and will definitely be returning. Full with so much culture and everyone is really really nice"
"1689935373-173","https://www.tripadvisor.com/Hotel_Review-g150813-d19369566-Reviews-or80-Copal_Tulum_Hotel-Tulum_Yucatan_Peninsula.html#REVIEWS","8","https://www.tripadvisor.com/Hotel_Review-g150813-d19369566-Reviews-or70-Copal_Tulum_Hotel-Tulum_Yucatan_Peninsula.html","Very helpful & very nice staff , beautiful garden view from the balcony. Nice pool area. Lounge area upstairs from lobby was nice & convenient. They offer lemon water in the lobby which is a great amenity. They have a restaurant and infinity bool with a bar on the rooftop. Would definitely be back. Our stay was perfect."
"1689935373-174","https://www.tripadvisor.com/Hotel_Review-g150813-d19369566-Reviews-or80-Copal_Tulum_Hotel-Tulum_Yucatan_Peninsula.html#REVIEWS","8","https://www.tripadvisor.com/Hotel_Review-g150813-d19369566-Reviews-or70-Copal_Tulum_Hotel-Tulum_Yucatan_Peninsula.html","It was amazing, staff were really helpful great ambience and service  The pools were amazing service and fantastic and clean  Great room sizes and fresh fruit and water  Really amazing staff helped with all my queries"
"1689935393-175","https://www.tripadvisor.com/Hotel_Review-g150813-d19369566-Reviews-or80-Copal_Tulum_Hotel-Tulum_Yucatan_Peninsula.html#REVIEWS","7","https://www.tripadvisor.com/Hotel_Review-g150813-d19369566-Reviews-or60-Copal_Tulum_Hotel-Tulum_Yucatan_Peninsula.html","The hotel grounds are amazing, hotel staff, AMAZING; from Claudio, Rafael and everyone else we encountered just outstanding customer service.   The food at the international restaurant was also amazing, everything we ordered was absolutely delicious.   This location is a nice relaxing hotel!!"
"1689935393-176","https://www.tripadvisor.com/Hotel_Review-g150813-d19369566-Reviews-or80-Copal_Tulum_Hotel-Tulum_Yucatan_Peninsula.html#REVIEWS","7","https://www.tripadvisor.com/Hotel_Review-g150813-d19369566-Reviews-or60-Copal_Tulum_Hotel-Tulum_Yucatan_Peninsula.html","The hotel is beautiful. Both pools are spectacular.  The customer service is fast and responsive. They are all very friendly.   They have scooter rentals which we highly recommend! They make your stay in tulum very convenient."
"1689935393-177","https://www.tripadvisor.com/Hotel_Review-g150813-d19369566-Reviews-or80-Copal_Tulum_Hotel-Tulum_Yucatan_Peninsula.html#REVIEWS","7","https://www.tripadvisor.com/Hotel_Review-g150813-d19369566-Reviews-or60-Copal_Tulum_Hotel-Tulum_Yucatan_Peninsula.html","The hotel is beautiful and has a great atmosphere. Great pools great vegetation, staff was great. I really recommend staying here. Close the the city center which is very great. Thank you for everything"
"1689935393-178","https://www.tripadvisor.com/Hotel_Review-g150813-d19369566-Reviews-or80-Copal_Tulum_Hotel-Tulum_Yucatan_Peninsula.html#REVIEWS","7","https://www.tripadvisor.com/Hotel_Review-g150813-d19369566-Reviews-or60-Copal_Tulum_Hotel-Tulum_Yucatan_Peninsula.html","Amazing ambiance, very peaceful stay. They will do anything you ask of them. All of the staff is very helpful. They were very honest and helpful with changes that we needed in our room. They even provided us bud spray"
"1689935393-179","https://www.tripadvisor.com/Hotel_Review-g150813-d19369566-Reviews-or80-Copal_Tulum_Hotel-Tulum_Yucatan_Peninsula.html#REVIEWS","7","https://www.tripadvisor.com/Hotel_Review-g150813-d19369566-Reviews-or60-Copal_Tulum_Hotel-Tulum_Yucatan_Peninsula.html","We had a lovely time here. I broke my arm before arriving at the hotel and the staff was absolutely helpful and so nice to me everyday, they always make sure we had everything we need, even if it was ice in the middle of the night delivered to the room. The hotel is absolutely amazing, the pools are beautiful and the restaurant too. The vibe is simply magic. I would definitely recommend!!"
"1689935393-180","https://www.tripadvisor.com/Hotel_Review-g150813-d19369566-Reviews-or80-Copal_Tulum_Hotel-Tulum_Yucatan_Peninsula.html#REVIEWS","7","https://www.tripadvisor.com/Hotel_Review-g150813-d19369566-Reviews-or60-Copal_Tulum_Hotel-Tulum_Yucatan_Peninsula.html","I stayed at Copal Tulum in December 2022.  Following shortening my stay the hotel signed a legal agreement to refund me MXN21,240.42. It was guaranteed that this would be settled within 10-12 days. It is now 4 months since I left the hotel, no refund has been settled and I haven’t received a communication in over 2 months.  Following yhis long period of time trying to courteously contact the hotel to resolve this legal undertaking, they have simply stopped responding to any communications. I don’t know what else to do, they seem to respond to tripadvisor comments more actively than they do private courteous communications, so I’m left with no choice but to try and elicit a response and resolution on this public forum.  All I want is the contractual refund signed fulfilled,"
"1689935393-181","https://www.tripadvisor.com/Hotel_Review-g150813-d19369566-Reviews-or80-Copal_Tulum_Hotel-Tulum_Yucatan_Peninsula.html#REVIEWS","7","https://www.tripadvisor.com/Hotel_Review-g150813-d19369566-Reviews-or60-Copal_Tulum_Hotel-Tulum_Yucatan_Peninsula.html","Best hotel to come to I had a great experience my whole time here everybody was friendly and polite the rooms were beautiful and comfortable had a great time overall can’t wait to come here again……….."
"1689935393-182","https://www.tripadvisor.com/Hotel_Review-g150813-d19369566-Reviews-or80-Copal_Tulum_Hotel-Tulum_Yucatan_Peninsula.html#REVIEWS","7","https://www.tripadvisor.com/Hotel_Review-g150813-d19369566-Reviews-or60-Copal_Tulum_Hotel-Tulum_Yucatan_Peninsula.html","Beautiful hotel, feels like a sanctuary; we stayed in a room with rooftop pool - definitely recommend! Yoga every morning from 9-10. Hotel has its own jungle - overall very spiritually Mexican Danny and Betty from concierge made our stay even better, they will take care of you if anything is wrong  It’s not your traditional American hotel though - no coffee in the room, no wash clothes, no food served late at night (after 11 you can only order drinks for your room service) - just be prepared for that"
"1689935419-183","https://www.tripadvisor.com/Hotel_Review-g150813-d19369566-Reviews-Copal_Tulum_Hotel-Tulum_Yucatan_Peninsula.html","6","https://www.tripadvisor.com/Hotel_Review-g150813-d19369566-Reviews-or50-Copal_Tulum_Hotel-Tulum_Yucatan_Peninsula.html","10/10 the experience! It was very comforting and the rooms are always at cool temperature especially in this hot weather 😅. The food was very delicious at RUMBA restaurant at the hotel, in my opinion way better than the Japanese restaurant. The aesthetic is very pleasing and the vibe is everything!! The pool is very beautiful and warm, please if you can head over there. Service was very awesome and everyone was so kind :) This hotel is very awesome and close to downtown cancun however if you plan on going to day/beach clubs please plan to rent a car or find something convenient. Taxis are very overpriced! Take a mopad or atv for the day and drive your self out there responsibly"
"1689935419-184","https://www.tripadvisor.com/Hotel_Review-g150813-d19369566-Reviews-Copal_Tulum_Hotel-Tulum_Yucatan_Peninsula.html","6","https://www.tripadvisor.com/Hotel_Review-g150813-d19369566-Reviews-or50-Copal_Tulum_Hotel-Tulum_Yucatan_Peninsula.html","The hotel is very beautiful. Rooms are nice and clean. We were transferred from another runba hotel and well received. Staff is very nice and Claudio very hard working and helpful.   One small note: we never got enough towels"
