web-scraper-order,web-scraper-start-url,pages,pages-href,reviews
"1689281490-1","https://www.tripadvisor.com/Hotel_Review-g150800-d153937-Reviews-Gran_Hotel_Ciudad_De_Mexico-Mexico_City_Central_Mexico_and_Gulf_Coast.html","6","https://www.tripadvisor.com/Hotel_Review-g150800-d153937-Reviews-or50-Gran_Hotel_Ciudad_De_Mexico-Mexico_City_Central_Mexico_and_Gulf_Coast.html","I would highly recommend staying here, first class treatment! We were introduced to our room in a way I have only seen a couple of times when I had the pleasure of staying at a 5+ star hotel. The buffet breakfast that was included in our price was a much better than expected value. Service wasn't as attentive as could have been, but the immediately responded to any request. Great Downtown location the rooftop hotel overlooks the plaza. We will definitely stay here again and again!"
"1689281490-2","https://www.tripadvisor.com/Hotel_Review-g150800-d153937-Reviews-Gran_Hotel_Ciudad_De_Mexico-Mexico_City_Central_Mexico_and_Gulf_Coast.html","6","https://www.tripadvisor.com/Hotel_Review-g150800-d153937-Reviews-or50-Gran_Hotel_Ciudad_De_Mexico-Mexico_City_Central_Mexico_and_Gulf_Coast.html","This is a wonderful hotel, locations is perfect and service is formidable. Monica de La Rosa in charge of reservations with the help of  Mariana Reyes are always helpful and outstanding when booking. They do not miss a single detail no matter how small or big our group is. They are great at their job. I have no words to describe how marvelous this hotel is."
"1689281490-3","https://www.tripadvisor.com/Hotel_Review-g150800-d153937-Reviews-Gran_Hotel_Ciudad_De_Mexico-Mexico_City_Central_Mexico_and_Gulf_Coast.html","6","https://www.tripadvisor.com/Hotel_Review-g150800-d153937-Reviews-or50-Gran_Hotel_Ciudad_De_Mexico-Mexico_City_Central_Mexico_and_Gulf_Coast.html","Have a meal or a drink here for the best views of Mexico City's main square. Ride the old world elevator all the way up, then go up two more stories. It all feels incredibly luxurious, but it is within reach of most tourists."
"1689281490-4","https://www.tripadvisor.com/Hotel_Review-g150800-d153937-Reviews-Gran_Hotel_Ciudad_De_Mexico-Mexico_City_Central_Mexico_and_Gulf_Coast.html","6","https://www.tripadvisor.com/Hotel_Review-g150800-d153937-Reviews-or50-Gran_Hotel_Ciudad_De_Mexico-Mexico_City_Central_Mexico_and_Gulf_Coast.html","Marco Martinez Maldonado was an awesome server. He helped me with my Spanish and recommended local spots for us to check out. He was super attentive, kind, and patient. I highly recommend him and will revisit this restaurant because the service he gave was top notch. Would recommend—10/10!"
"1689281490-5","https://www.tripadvisor.com/Hotel_Review-g150800-d153937-Reviews-Gran_Hotel_Ciudad_De_Mexico-Mexico_City_Central_Mexico_and_Gulf_Coast.html","6","https://www.tripadvisor.com/Hotel_Review-g150800-d153937-Reviews-or50-Gran_Hotel_Ciudad_De_Mexico-Mexico_City_Central_Mexico_and_Gulf_Coast.html","We stated at the Gran Hotel Cuidad for 4 nights.  It was a great experience. The hotel is beautiful, and the location cannot be beat – right on Zocalo square.  The outdoor covered terrace on the rooftop overlooked Zocalo and was a wonderful location for breakfast and late-night drinks.  The staff was gracious, especially one of the door stewards, Victor.  They helped us line up things to do and made good suggestions for restaurants and shopping. And, of course, we also spent time trying to see where parts of the James Bond film were shot!   There was nothing we did not dislike.  We stayed in a junior suite.  It would have been nice to have more than one capsule of caffeinated coffee in the room (we did get more at the front desk).  A nightly turn-down would also have been nice"
"1689281490-6","https://www.tripadvisor.com/Hotel_Review-g150800-d153937-Reviews-Gran_Hotel_Ciudad_De_Mexico-Mexico_City_Central_Mexico_and_Gulf_Coast.html","6","https://www.tripadvisor.com/Hotel_Review-g150800-d153937-Reviews-or50-Gran_Hotel_Ciudad_De_Mexico-Mexico_City_Central_Mexico_and_Gulf_Coast.html","We stayed for 5 nights and it was truly a luxurious experience from beginning to end. For a couples getaway we highly recommend the zocalo view suite. It is spacious and elegantly decorated with historical style. We enjoyed  breakfast and most evening meals at the hotel, and can say only good things about the food, service, and atmosphere at the restaurant and throughout the hotel. We hope to come back soon!"
"1689281490-7","https://www.tripadvisor.com/Hotel_Review-g150800-d153937-Reviews-Gran_Hotel_Ciudad_De_Mexico-Mexico_City_Central_Mexico_and_Gulf_Coast.html","6","https://www.tripadvisor.com/Hotel_Review-g150800-d153937-Reviews-or50-Gran_Hotel_Ciudad_De_Mexico-Mexico_City_Central_Mexico_and_Gulf_Coast.html","I am typically not a luxury hotel traveller - I prefer Airbnbs and hostels. But Gran Hotel Ciudad de Mexico is the wonderful exception that proves the rule. I came for the stained glass ceiling. But they don't just cash in on the ceiling as a gimmick - throughout the entire stay, they make you feel like a million bucks (apologies to readers who are worth more than a million bucks). They give you champagne when you check in, and have a plate waiting in your room with treats and your name written in chocolate. I didn't know I needed that in my life, but I did.  The porters are helpful in all ways, and speak fluent English. Just be sure, when checking out, to give some time for them to retrieve your car from parking. It took a good 20 minutes for them to bring it down, which had us"
"1689281490-8","https://www.tripadvisor.com/Hotel_Review-g150800-d153937-Reviews-Gran_Hotel_Ciudad_De_Mexico-Mexico_City_Central_Mexico_and_Gulf_Coast.html","6","https://www.tripadvisor.com/Hotel_Review-g150800-d153937-Reviews-or50-Gran_Hotel_Ciudad_De_Mexico-Mexico_City_Central_Mexico_and_Gulf_Coast.html","Loved my stay at this hotel.  Truly an experience of old- world luxury with the most courteous and helpful staff I have encountered in my travels.    The building itself is significant to the history of Mexico City, and the hotel has been maintained to honor that history.  And everyone - from the bellboys to the front desk staff to the restaurant staff - is friendly, professional, and kind.  (I was traveling solo, stayed for only 4 nights, and at least 3 or 4 staff members greeted me by name by day 2.)  My stay included breakfast, and the Terraza is amazing.  It overlooks the Zocalo, and the food is top notch.  I’ve been told by my tour guides that locals frequently come here as well for a special meal.  Just a reminder, though, this is a historic hotel in the heart of the"
"1689281490-9","https://www.tripadvisor.com/Hotel_Review-g150800-d153937-Reviews-Gran_Hotel_Ciudad_De_Mexico-Mexico_City_Central_Mexico_and_Gulf_Coast.html","6","https://www.tripadvisor.com/Hotel_Review-g150800-d153937-Reviews-or50-Gran_Hotel_Ciudad_De_Mexico-Mexico_City_Central_Mexico_and_Gulf_Coast.html","From the time you arrive until you depart the customer service is exceptional.  Upon arrival a bellman carries your bags up to reception, then serves you champagne as you check in.  Everyone is helpful.  When we called to get anything taken care of, extra towels, help with the safe, they arrive promptly and courteously.  Beautiful architecture, Tiffany glass ceiling, art deco.  The location is next to Zocalo square.  Convienant to many sights and restaurants.  They also have a roof top restuarant, service was lovely.  True old fashion customer service."
"1689281490-10","https://www.tripadvisor.com/Hotel_Review-g150800-d153937-Reviews-Gran_Hotel_Ciudad_De_Mexico-Mexico_City_Central_Mexico_and_Gulf_Coast.html","6","https://www.tripadvisor.com/Hotel_Review-g150800-d153937-Reviews-or50-Gran_Hotel_Ciudad_De_Mexico-Mexico_City_Central_Mexico_and_Gulf_Coast.html","We cannot express our wonderful experience with our dining experience at the La Terraza in the Gran Hotel Ciudad Mexico. The staff were very attentive at your every needs. In particular Alejandro was great. He attended to our anniversary dinner which made it very special. Alejandro also took photos of our which captured the moment just perfect. Being in Mexico we were not sure on our wine selection, we asked his recommendation and it turned out to be an excellent choice. Alejandro is the best. We highly recommend the hotel and restaurant."
"1689281510-11","https://www.tripadvisor.com/Hotel_Review-g150800-d153937-Reviews-Gran_Hotel_Ciudad_De_Mexico-Mexico_City_Central_Mexico_and_Gulf_Coast.html","5","https://www.tripadvisor.com/Hotel_Review-g150800-d153937-Reviews-or40-Gran_Hotel_Ciudad_De_Mexico-Mexico_City_Central_Mexico_and_Gulf_Coast.html","This hotel was recommended to us by a friend who couldn't have said enough good things about it - and he was so correct! A luxurious hotel at a most reasonable price.  The staff were kind, courteous and helpful.  The hotel located on historic Zacola  Square is not only well situated, it offers an excellent panoramic view of the square.  The morning breakfast is voluminous with endless options.  The rooms are well appointed and most comfortable.  I would recommend this hotel to anyone going to visit Cuidad de Mexico."
"1689281510-12","https://www.tripadvisor.com/Hotel_Review-g150800-d153937-Reviews-Gran_Hotel_Ciudad_De_Mexico-Mexico_City_Central_Mexico_and_Gulf_Coast.html","5","https://www.tripadvisor.com/Hotel_Review-g150800-d153937-Reviews-or40-Gran_Hotel_Ciudad_De_Mexico-Mexico_City_Central_Mexico_and_Gulf_Coast.html","The Hotel is on the edge of the Zocalo (Square) - the Plaza de la Constitución - at the Mexico City Historic centre.  It has a luxurious interior and is replete with old world features including an antique elevator as part of the decor.  The stained glass ceiling is famous.  The top floor with a further spiral stairway takes you to the Restaurant - the La Terraza - it includes an open terrace that looks directly down upon the City Zocalo.  All staff throughout the Hotel are very customer focused, always smiling and at your service.  It is well justified to leave a 100 peso gratuity on your bed each morning for the room attendants and a gratuity (or propina) of 10-15-20% for each restaurant meal's bill (la cuenta) is well received.  A short walk in any direction from the Hotel"
"1689281510-13","https://www.tripadvisor.com/Hotel_Review-g150800-d153937-Reviews-Gran_Hotel_Ciudad_De_Mexico-Mexico_City_Central_Mexico_and_Gulf_Coast.html","5","https://www.tripadvisor.com/Hotel_Review-g150800-d153937-Reviews-or40-Gran_Hotel_Ciudad_De_Mexico-Mexico_City_Central_Mexico_and_Gulf_Coast.html","Spectacular hotel in the heart of the city. Very reasonably priced and included a great buffet breakfast overlooking the main city square. Architecture and stained glass roof were awesome. Champagne when we arrived and great staff. Always bottled water on every floor. Steps away from amazing sites."
"1689281510-14","https://www.tripadvisor.com/Hotel_Review-g150800-d153937-Reviews-Gran_Hotel_Ciudad_De_Mexico-Mexico_City_Central_Mexico_and_Gulf_Coast.html","5","https://www.tripadvisor.com/Hotel_Review-g150800-d153937-Reviews-or40-Gran_Hotel_Ciudad_De_Mexico-Mexico_City_Central_Mexico_and_Gulf_Coast.html","We had a very positive experience staying at the hotel.  The location is perfect, just off of the Zocalo and close to a number of sites.  We had an interior suite and it was fine - spacious and comfortable.  We included breakfast in our booking.  The breakfast buffet was very good, and worth including as it was expensive if you did not have it included with your room."
"1689281510-15","https://www.tripadvisor.com/Hotel_Review-g150800-d153937-Reviews-Gran_Hotel_Ciudad_De_Mexico-Mexico_City_Central_Mexico_and_Gulf_Coast.html","5","https://www.tripadvisor.com/Hotel_Review-g150800-d153937-Reviews-or40-Gran_Hotel_Ciudad_De_Mexico-Mexico_City_Central_Mexico_and_Gulf_Coast.html","Excellent location, breakfast buffet at the rooftop restaurant  Super charming decor. Friendly staff Excellent View over the square the Zocalo, close to many things to see like the Cathedral, Diego’s wall paintings, Aztec ruins. Was casting location for James Bond movie Spectre 👍🏻"
"1689281510-16","https://www.tripadvisor.com/Hotel_Review-g150800-d153937-Reviews-Gran_Hotel_Ciudad_De_Mexico-Mexico_City_Central_Mexico_and_Gulf_Coast.html","5","https://www.tripadvisor.com/Hotel_Review-g150800-d153937-Reviews-or40-Gran_Hotel_Ciudad_De_Mexico-Mexico_City_Central_Mexico_and_Gulf_Coast.html","If you’re visiting Mexico City stay here. Great location and felt very safe. Rooms are lovely and even room 207 which was only a double was pretty big. My only gripe, you need to provide better quality and a bigger quantity of toiletries. For such a nice hotel you need to get that sorted out. Based in the historic centre so is in an excellent position 30 mins from airport."
"1689281510-17","https://www.tripadvisor.com/Hotel_Review-g150800-d153937-Reviews-Gran_Hotel_Ciudad_De_Mexico-Mexico_City_Central_Mexico_and_Gulf_Coast.html","5","https://www.tripadvisor.com/Hotel_Review-g150800-d153937-Reviews-or40-Gran_Hotel_Ciudad_De_Mexico-Mexico_City_Central_Mexico_and_Gulf_Coast.html","Great place to stay right on the Zocalo.  (Not quiet but that should not be the expectation.)  Absolutely beautiful facility at a reasonable price with friendly and competent staff.  Air conditioning in our room didn't work and the restaurant in the building is not one of the better ones in the area.  But a great place to stay."
"1689281510-18","https://www.tripadvisor.com/Hotel_Review-g150800-d153937-Reviews-Gran_Hotel_Ciudad_De_Mexico-Mexico_City_Central_Mexico_and_Gulf_Coast.html","5","https://www.tripadvisor.com/Hotel_Review-g150800-d153937-Reviews-or40-Gran_Hotel_Ciudad_De_Mexico-Mexico_City_Central_Mexico_and_Gulf_Coast.html","Marco y Edgar we're great at the brunch, at La Terraza, they were great servers and the food was amazing. Huge variety and a great view. The brunch includes mimosas and beer, it was so worth it. Thank you guys!"
"1689281510-19","https://www.tripadvisor.com/Hotel_Review-g150800-d153937-Reviews-Gran_Hotel_Ciudad_De_Mexico-Mexico_City_Central_Mexico_and_Gulf_Coast.html","5","https://www.tripadvisor.com/Hotel_Review-g150800-d153937-Reviews-or40-Gran_Hotel_Ciudad_De_Mexico-Mexico_City_Central_Mexico_and_Gulf_Coast.html","Excellent service by Diego and Maria and brunch was amazing.  The hotel was also amazing with historic elevators.  This is a must see in Mexico City.  We have been to other locations and this superseded our expectations.  We will return soon."
"1689281510-20","https://www.tripadvisor.com/Hotel_Review-g150800-d153937-Reviews-Gran_Hotel_Ciudad_De_Mexico-Mexico_City_Central_Mexico_and_Gulf_Coast.html","5","https://www.tripadvisor.com/Hotel_Review-g150800-d153937-Reviews-or40-Gran_Hotel_Ciudad_De_Mexico-Mexico_City_Central_Mexico_and_Gulf_Coast.html","We stayed four nights in a wonderful room overlooking the square which comes alive with lights at night and you can also enjoy from the amazing terrace restaurant. So try the giant margaritas there! Food really delicious too. We did several day trips. When the one organised by the hotel wasn’t very good (city tour) the hotel couldn’t have been more apologetic, reimbursing from the tour operator and being so very helpful in all respects. The concierge is amazing here. And it’s such a thrill to know Spectre was filmed here. I much prefer this part of town too with its history and grandeur. The best hotel experience - Thank you! We’d love to come back."
"1689281531-21","https://www.tripadvisor.com/Hotel_Review-g150800-d153937-Reviews-Gran_Hotel_Ciudad_De_Mexico-Mexico_City_Central_Mexico_and_Gulf_Coast.html","4","https://www.tripadvisor.com/Hotel_Review-g150800-d153937-Reviews-or30-Gran_Hotel_Ciudad_De_Mexico-Mexico_City_Central_Mexico_and_Gulf_Coast.html","Christopher and Freddy made our visit amazing!!! We came to celebrate our 20-year anniversary, and they  went above and beyond our expectations!!!!   The view was amazing! We were treated like family! This is a must do for anyone visiting and wants a great memory for your visit to Mexico City!"
"1689281531-22","https://www.tripadvisor.com/Hotel_Review-g150800-d153937-Reviews-Gran_Hotel_Ciudad_De_Mexico-Mexico_City_Central_Mexico_and_Gulf_Coast.html","4","https://www.tripadvisor.com/Hotel_Review-g150800-d153937-Reviews-or30-Gran_Hotel_Ciudad_De_Mexico-Mexico_City_Central_Mexico_and_Gulf_Coast.html","This is a mixed review.  The hotel staff and the facility were amazing.  The room was clean and comfortable.  Our only issue came with the restaurant upstairs.  The menu wasn't great and the service was pretty poor at times.  At one dinner, we were repeatedly ignored by wait staff.  I had to get up and get my wife a napkin and silverware, even after requesting it.  When we finally were served, our dinners were cold and my steak was nearly raw.  I couldn't eat it.  They did take the steak off the bill, however, and the waiter gave us a piece of cake and apologized for the poor service.  Overall, I would stay there, but look for other places to eat."
"1689281531-23","https://www.tripadvisor.com/Hotel_Review-g150800-d153937-Reviews-Gran_Hotel_Ciudad_De_Mexico-Mexico_City_Central_Mexico_and_Gulf_Coast.html","4","https://www.tripadvisor.com/Hotel_Review-g150800-d153937-Reviews-or30-Gran_Hotel_Ciudad_De_Mexico-Mexico_City_Central_Mexico_and_Gulf_Coast.html","Glorious historic building with jaw dropping lobby. The rooms are big and perhaps a tad old fashioned in their furnishing but comfortable and spotlessly clean and everything works. You’re slap bang in the centre of el centro and as a tourist there’s no better place to stay. The restaurant La Terraza looks out over the Zocalo. The food is great and the views superb. Note that as a guest you do not need to reserve more than a few hours in advance - they keep tables for huéspedes. The team is professional and nothing is too much trouble. This really is a classy operation. In London or New York it would be five times the price. It’s a great choice. I can’t imagine staying anywhere else in CDMX."
"1689281531-24","https://www.tripadvisor.com/Hotel_Review-g150800-d153937-Reviews-Gran_Hotel_Ciudad_De_Mexico-Mexico_City_Central_Mexico_and_Gulf_Coast.html","4","https://www.tripadvisor.com/Hotel_Review-g150800-d153937-Reviews-or30-Gran_Hotel_Ciudad_De_Mexico-Mexico_City_Central_Mexico_and_Gulf_Coast.html","Alfredo and Alejandro were so gentle with us, the place is awesome and beautiful architecture, food so tasty and clean; this is a great place to enjoy Mexican food and have a great view of El Zocalo in Mexico City."
"1689281531-25","https://www.tripadvisor.com/Hotel_Review-g150800-d153937-Reviews-Gran_Hotel_Ciudad_De_Mexico-Mexico_City_Central_Mexico_and_Gulf_Coast.html","4","https://www.tripadvisor.com/Hotel_Review-g150800-d153937-Reviews-or30-Gran_Hotel_Ciudad_De_Mexico-Mexico_City_Central_Mexico_and_Gulf_Coast.html","We had an amazing stay at this hotel, a beautiful historical building that appeared in the Jame Bond movie ""Spectre"". Our room was perfectly comfortable and quiet. The location was right on the Zocalo in the historical center. We had drinks nearly every night at the terrace restaurant with an amazing view of the square. I read some comments that the area didn't feel safe at night. While it is true that it's deserted compared to daytime, we never felt unsafe. And the main pedestrianized street next to the hotel had plenty of people.  I also want to give special shout out to the breakfast. It is literally the most delicious and plentiful buffet I've ever had (and this is in comparison with some of the outrageous breakfast buffet in Asian countries). There's made-to-order eggs with"
"1689281531-26","https://www.tripadvisor.com/Hotel_Review-g150800-d153937-Reviews-Gran_Hotel_Ciudad_De_Mexico-Mexico_City_Central_Mexico_and_Gulf_Coast.html","4","https://www.tripadvisor.com/Hotel_Review-g150800-d153937-Reviews-or30-Gran_Hotel_Ciudad_De_Mexico-Mexico_City_Central_Mexico_and_Gulf_Coast.html","The location is excellent if you are an art lover, else, no entertainment or good restaurants around.the room was comfortable. The hotel is lifeless, and about the terrasse restaurant , don’t bother going for a late dinner, we got kicked out at 11 pm sharp , being told we could take the drink in our room and they closed the curtain by our table to block the view… a disgrace!"
"1689281531-27","https://www.tripadvisor.com/Hotel_Review-g150800-d153937-Reviews-Gran_Hotel_Ciudad_De_Mexico-Mexico_City_Central_Mexico_and_Gulf_Coast.html","4","https://www.tripadvisor.com/Hotel_Review-g150800-d153937-Reviews-or30-Gran_Hotel_Ciudad_De_Mexico-Mexico_City_Central_Mexico_and_Gulf_Coast.html","The Gran Hotel is first of all, absolutely stunning and a must visit even if you don't stay there. We stayed there three nights and had an amazing experience. We booked a junior suite looking out to the Zocalo and got upgraded to a master suite. It was giant and the view was spectacular (go to the Terazza for a similar view!), though if you have the bad luck of running into a demonstration on the square like we did, it can be very loud. However the gracious staff gave us a key to an interior room on the night it was loud. We ended up not needing it since it quieted down before our bedtime but the gesture was extremely appreciated. I was also impressed with the security during the event.   I definitely want to mention the breakfast buffet which was included in our rate and quite"
"1689281531-28","https://www.tripadvisor.com/Hotel_Review-g150800-d153937-Reviews-Gran_Hotel_Ciudad_De_Mexico-Mexico_City_Central_Mexico_and_Gulf_Coast.html","4","https://www.tripadvisor.com/Hotel_Review-g150800-d153937-Reviews-or30-Gran_Hotel_Ciudad_De_Mexico-Mexico_City_Central_Mexico_and_Gulf_Coast.html","Great service and Marcelo and Marcos were attentive to our needs. I enjoyed the drinks and everything went smooth. The view was great and we definitely enjoyed vegan options and the mojitos were great"
"1689281531-29","https://www.tripadvisor.com/Hotel_Review-g150800-d153937-Reviews-Gran_Hotel_Ciudad_De_Mexico-Mexico_City_Central_Mexico_and_Gulf_Coast.html","4","https://www.tripadvisor.com/Hotel_Review-g150800-d153937-Reviews-or30-Gran_Hotel_Ciudad_De_Mexico-Mexico_City_Central_Mexico_and_Gulf_Coast.html","This hotel is NOT DISABILITY FRIENDLY.  If you are disabled you need to enter through a side alley and step on a small steel platform that moves you up like a small fenicula.  It is not very safe.  And you feel like a slab of meat.  The ONLY restaurant available for guests was on the rooftop which required you to climb a long, winding staircase.  This winding staircase might as well have been Mt Everest for my 91 year old father.   He would never make that climb.   My father uses a walker or wheelchair.   It states on the website there are 2 restaurants.  The other restaurant was on the main floor and was closed.   My father could’ve used this restaurant if it was open.  They would not open it for my elderly, disabled father.   They said, “ you could order room service.”"
"1689281531-30","https://www.tripadvisor.com/Hotel_Review-g150800-d153937-Reviews-Gran_Hotel_Ciudad_De_Mexico-Mexico_City_Central_Mexico_and_Gulf_Coast.html","4","https://www.tripadvisor.com/Hotel_Review-g150800-d153937-Reviews-or30-Gran_Hotel_Ciudad_De_Mexico-Mexico_City_Central_Mexico_and_Gulf_Coast.html","Just returned from a 4 night stay at the Gran Hotel, CDMX. I must say the hotel exceeded my high expectations from the beginning. From the welcome champagne glass at check in to the attention to every detail during your stay. Staff is extremely helpful and friendly, providing top level service. The room was a master suit which the family and I enjoyed immensely. The Terraza roof top restaurant was a great place for lunch and dinner over looking the Zocalo. Staying in the historic center provides a great opportunity to explore the surroundings. The area is extremely safe and well policed. For the best tacos in the area go to los cocuyos about 5 blocks away. We highly recommend staying at The Gran Hotel and plan to return in the near future. Thanks."
"1689281549-31","https://www.tripadvisor.com/Hotel_Review-g150800-d153937-Reviews-Gran_Hotel_Ciudad_De_Mexico-Mexico_City_Central_Mexico_and_Gulf_Coast.html","3","https://www.tripadvisor.com/Hotel_Review-g150800-d153937-Reviews-or20-Gran_Hotel_Ciudad_De_Mexico-Mexico_City_Central_Mexico_and_Gulf_Coast.html","Amazing experience! We absolutely loved staying here! Each person who works here loves what they do and are so kind and sweet. We especially loved the lady in the front desk, Vivian. She went above and beyond, always smiling and making the entire experience phenomenal! The uniforms for the bell boys and the cleaning staff were incredible! The restaurant was wonderful with its breath taking view and delicious assortment of food and drinks!"
"1689281549-32","https://www.tripadvisor.com/Hotel_Review-g150800-d153937-Reviews-Gran_Hotel_Ciudad_De_Mexico-Mexico_City_Central_Mexico_and_Gulf_Coast.html","3","https://www.tripadvisor.com/Hotel_Review-g150800-d153937-Reviews-or20-Gran_Hotel_Ciudad_De_Mexico-Mexico_City_Central_Mexico_and_Gulf_Coast.html","Best view of the historic city center in Mexico City. Christopher and Marcelo provided perfect service. We tried our best at Spanglish but they were very accommodating. The food was 10/10 and the margaritas are awesome. The “dunch” is about $41USD PP and includes unlimited food; including tacos, omelettes, and quesadillas fresh to order, along with a standard buffet of Mexican food, desserts and pastries. Margaritas, beer and mimosas are also unlimited and included. highly recommend!"
